datetime,headline
2020-02-29 11:30,談第34例確診個案院內感染脫口「林口」2字 陳時中急改口：請忽略地點 - 風傳媒
2020-02-29 11:30,Google Appoints First-Ever ‘Creator Liaison’ for YouTube - Search Engine Journal
2020-02-29 11:30,"Pertashop Bensin Eceran Resmi Pertamina, Modal Kecil Pemilik Bisa Raup Untung Rp 7,5 Juta Perbulan - Semua Halaman - Grid Motor"
2020-02-29 11:30,Hong Kong police arrest media tycoon Jimmy Lai on illegal assembly charges - Reuters
2020-02-29 11:30,Kakek 103 Tahun di Sulsel Nikahi Gadis Perawan sudah Menduda Sewindu - detikNews
2020-02-29 11:30,¿Qué es el coronavirus y cuáles son sus síntomas? - El Tiempo de México
2020-02-29 11:30,Reportan caso sospechoso de coronavirus en Arequipa - Diario Correo
2020-02-29 11:30,"Grande aposta de Biden, Carolina do Sul realiza primária democrata neste sábado - G1"
2020-02-29 11:30,"Ο Αντετοκούνμπο απάντησε στον Χάρντεν: Δύναμη χρησιμοποιούσαν και ο Τζόρνταν, ο Κόμπι Μπράιαντ και ο Σακίλ - Πρώτο ΘΕΜΑ"
2020-02-29 11:30,"Pomysłowy Polak stworzył aplikację, która namierza nieoznakowane radiowozy - MamBiznes"
2020-02-29 11:30,الزمالك يقلب الطاولة على الترجي ويضع قدما في نصف نهائي دوري الأبطال (فيديو) - روسيا اليوم
2020-02-29 11:30,"Head-to-Head Review: 2020 BMW X5M & X6M Are Blindingly Quick, but Are They Off-Road Worthy? - The Fast Lane Car"
2020-02-29 11:30,Ekiti dismisses three randy teachers - The Nation Newspaper
2020-02-29 11:30,Gov't lifts restriction on cement investment - The Reporter Ethiopia
2020-02-29 11:30,"Marcelo Gallardo versus Nahuel Gallardo, rivales íntimos: las bromas de los jugadores de Defensa y el “mensaje cábala” que esta vez no llegará - Infobae.com"
2020-02-29 11:30,"Alexander Ludwig, Björn en Viking, lanza su primer sencillo como cantante - Publimetro México"
2020-02-29 11:30,武漢肺炎》中國製造業PMI創史上新低 野村：實際數字可能更糟 - 自由時報電子報
2020-02-29 11:30,Van tres casos de coronavirus en México: Salud descartó emergencia nacional - Infobae.com
2020-02-29 11:30,SIA CEO announces 15% pay cut for himself; he earns $1.4m in salary with total package $5.5m last FY - The Online Citizen
2020-02-29 11:30,武漢肺炎》前白宮經濟顧問哈塞特：疫情絕對能引發全球經濟衰退 - 自由時報電子報
2020-02-29 11:30,Descubren la mayor explosión en el universo después del “Bing Bang” - Deutsche Welle
2020-02-29 11:30,Uuministeli tawu nana nondatu komikanda dhomalweendo - Namibian
2020-02-29 11:30,The spread of the coronavirus couldn't have come at a worse time for Corona beer - CNN
2020-02-29 11:30,“Saber que meu nome está do lado dos maiores dá muita emoção”: Gabigol valoriza legado no Flamengo - Coluna do Fla
2020-02-29 11:30,孩子有氣喘，要怎麼吃、怎麼避過敏原、能運動嗎？小兒科醫師公開「氣喘兒」7大育兒密技 - 風傳媒
2020-02-29 11:30,Hackean 10 populares VPN para mostrar que no son seguras - Profesional Review
2020-02-29 11:30,China's factories slow at record pace - NEWS.com.au
2020-02-29 11:30,Mass rescue on Mount Tibrogargan in Queensland's Glass House Mountains - ABC News
2020-02-29 11:30,Российский Kia Ceed получил цифровую приборку и стал дороже - motor.ru
2020-02-29 11:30,Acuerdo Estados Unidos-El Talibán: la incógnita sobre un futuro de paz en la tierra de la guerra permanente - Infobae.com
2020-02-29 11:30,"The Force Will Be With Neutron Stars, Always - Interesting Engineering"
2020-02-29 11:30,"I respect Akufo-Addo for his values, principles – Rawlings - GhanaWeb"
2020-02-29 11:30,"Israeli firm unveils kit to diagnose coronavirus, as 2nd team works on a vaccine - The Times of Israel"
2020-02-29 11:30,У короткій спідниці. Надя Дорофєєва здивувала пікантним знімком - НВ
2020-02-29 11:30,"Risk of coronavirus spreading globally now 'very high', World Health Organisation says - South China Morning Post"
2020-02-29 11:30,Has Disney+ Canceled the 'Lizzie McGuire' Reboot? - Showbiz Cheat Sheet
2020-02-29 11:30,Μαρτίνς: «Είμαστε έτοιμοι να συνεχίσουμε να γράφουμε ιστορία»! (vid) - gazzetta.gr
2020-02-29 11:30,Lukaku? Solskjaer slams ex-Man Utd players who flopped at Everton - Tribal Football
2020-02-29 11:30,Mack Horton and family hit with disgusting social media death threats after Sun Yang ban - Wide World of Sports
2020-02-29 11:30,"Com motim de policiais, número de assassinatos no Ceará mais que dobra em fevereiro - G1"
2020-02-29 11:30,Alberto Rodríguez pidió ser cambiado y abandonó el campo con gestos de molestia | VIDEO - El Bocón
2020-02-29 11:30,WHO raises global virus risk to maximum level - Philippine Star
2020-02-29 11:30,Jeff Hardy to Appear on Next Week’s “WWE Backstage” Broadcast - eWrestlingNews
2020-02-29 11:30,Putin Güvenlik Konseyini İdlib'deki durumla ilgili acil topladı - Anadolu Ajansı
2020-02-29 11:30,سوريا تشتعل بعدوان تركى.. و«الناتو» يدعو لوقف هجوم إدلب - المصري اليوم
2020-02-29 11:30,তদন্ত রিপোর্ট নিয়ে যা বললেন সালমানের মা - Prothom Alo
2020-02-29 11:30,Bad Bunny protesta por la muerte de una mujer transgénero en Puerto Rico - CNN México.com
2020-02-29 11:30,Trump nominates Congressman John Ratcliffe to be director of national intelligence - CBS News
2020-02-29 11:30,Aposta de Americana leva R$ 44 mil na quina da Mega-Sena - O Liberal
2020-02-29 11:30,"""أردوغان"": قتلنا 2000 جندي سوري - سبق"
2020-02-29 11:30,"South Korea reports 594 new COVID-19 cases; total cases now 2,931 - GMA News"
2020-02-29 11:30,Gabi pergunta se Guilherme beijou Bianca em festa - gshow
2020-02-29 11:30,Workers blockade military company over job lost fears - Namibian
2020-02-29 11:30,Kisah Heroik Polisi India: Lintasi Batas Negara Secara Ilegal Demi Selamatkan Warga Sipil - Kompas.com - Internasional Kompas.com
2020-02-29 11:30,World Health Organization raises global virus risk to maximum level - The Times of Israel
2020-02-29 11:30,7 beauty lessons from Son Ye-jin in Crash Landing On You - South China Morning Post
2020-02-29 11:30,Son dakika haberleri: Yunan sınırında göçmenlere müdahale! ‘Siz nasıl bir şeysiniz!’ diye isyan etti... - Hürriyet
2020-02-29 11:30,وفاة فنان ومخرج سوري - tayyar.org
2020-02-29 11:30,"İdlib şehitleri Kurtulmuş, Bağatur ve Akkaya son yolculuklarına uğurlandı - CNN Türk"
2020-02-29 11:30,Ana Maria Braga já tem data para voltar à TV após férias - Ofuxico
2020-02-29 11:30,Several Ethiopian cities reportedly experiencing power outage - borkena.com
2020-02-29 11:30,iPhone 11 Pro Max versus Nikon 7 Z - which is better for YouTube video creation? - AppleInsider
2020-02-29 11:30,"Ask your PH leaders why this is happening, Asyraf Wajdi tells Syed Saddiq - New Straits Times"
2020-02-29 11:30,Firefighters steal show at Mardi Gras from muscle-bound marchers and drag queens - The Sydney Morning Herald
2020-02-29 11:30,بعد الشائعات عن إصابات في بعض المدارس... وقف العام الدراسي أسبوعاً قابلاً للتجديد - tayyar.org
2020-02-29 11:30,أسعار السيارات تتهاوى.. تخفيضات تصل لـ 100000 جنيه - Sada El-Bald صدى البلد
2020-02-29 11:30,Ahli Kesehatan Ungkap 3 Kemungkinan Virus Corona Tak Terdeteksi di Indonesia | merdeka.com - merdeka.com
2020-02-29 11:30,الخارجية : مصر توقع بالأحرف الأولى على الاتفاق حول قواعد محددة لملء وتشغيل سد النهضة - بوابة الأهرام
2020-02-29 11:30,Fallece mujer a la que su marido le prendió fuego en Cuchilla de Villate - El Heraldo (Colombia)
2020-02-29 11:30,疫情期间孩子生病去不去医院？ 专家给出“三个一” - 京报网
2020-02-29 11:30,شركة ألمانية تكشف عن هاتف مصنوع من الكربون - الجزيرة
2020-02-29 11:30,Cancelan oficialmente GDC 2020 - Atomix
2020-02-29 11:30,En Pumas confirmaron que por el Día Internacional de la Mujer se cambió el día del clásico frente a América - Bolavip
2020-02-29 11:30,联合国秘书长称赞中国人民“为全人类做出贡献” - 南方网
2020-02-29 11:30,Lawyer shot dead inside his office in Nueva Ecijia - CNN Philippines
2020-02-29 11:30,"Coronavirus: China reports 47 more deaths, 427 new cases, East Asia News & Top Stories - The Straits Times"
2020-02-29 11:30,Niños mueren congelados mientras un ataque provoca el éxodo más grande de la guerra en Siria - Infobae.com
2020-02-29 11:30,Nancy Pelosi dice que se sentiría cómoda si Bernie Sanders gana la candidatura presidencial demócrata - CNN México.com
2020-02-29 11:30,"Coronavirus hoy: minuto a minuto, las novedades de la epidemia en la Argentina y el mundo - LA NACION"
2020-02-29 11:30,সমালোচকদের একহাত নিলেন শ্রুতি - Dhakatimes24
2020-02-29 11:30,"¿Yaneth Waldman confirmó que la ""despidieron"" de RCN con nostálgico mensaje? - Publimetro Colombia"
2020-02-29 11:30,Tu pizza en 30 segundos - LaRepública.pe
2020-02-29 11:30,Power Ranking the 4 Premier League teams in the Champions League - The Top Flight
2020-02-29 11:30,Ethio Lease to mechanise the agriculture sector - The Reporter Ethiopia
2020-02-29 11:30,Coronavirus now in Oregon - The Miracle Tech
2020-02-29 11:30,"Ser líder social, una profesión de alto riesgo - El Colombiano"
2020-02-29 11:30,坦言集：因禍得福？｜評論｜港澳｜on.cc東網 - on.cc東網
2020-02-29 11:30,《安家》罗晋：会像女性一样关心身边的人 - 人民网
2020-02-29 11:30,【PERSONA 5 ROYAL】P5R女神異聞錄5豪華版120小時爆機無劇透評測 - 香港01
2020-02-29 11:30,武漢肺炎》首傳院內感染就4人中鏢 張上淳：推測是手碰到口鼻所致 - 自由時報電子報
2020-02-29 11:30,Teen recommended for bravery award after stopping alleged domestic violence assault - 9News
2020-02-29 11:30,Beckham responds to rumours linking Ronaldo and Messi to Inter Miami - MARCA.com
2020-02-29 11:30,Majority of senators oppose VFA abrogation —Sotto - GMA News
2020-02-29 11:30,How The Odaw River Depicts A Time Bomb Waiting To Explode [PHOTOS] - Modern Ghana
2020-02-29 11:30,Vizcarra: No creo que hayan nuevos enfrentamientos entre Ejecutivo y Congreso - LaRepública.pe
2020-02-29 11:30,曾之喬拍美照被尪鎖喉 甜喊「放開那個老婆」 - udn 噓！星聞
2020-02-29 11:30,"Discurso del Ministro de Relaciones Exteriores de la República de Cuba, en el Segmento de Alto Nivel del 43 período ordinario de sesiones del Consejo de Derechos Humanos, Ginebra, 25 de febrero de 2020. | Ministerio de Relaciones Exteriores de Cuba - Ministerio de Relaciones Exteriores Cubano"
2020-02-29 11:30,Ο Τούρκος πρέσβης στον ΟΗΕ απειλεί τη Συρία - Newsbomb
2020-02-29 11:30,رغم تباطؤ إنتاج شركته.. رئيس آبل: الصين تسيطر على كورونا - الجزيرة
2020-02-29 11:30,"Ελένη Μενεγάκη: Η κόρη της, Μαρίνα γίνεται πέντε χρονών και αυτές είναι οι πιο πρόσφατες φώτο της! - Gossip TV"
2020-02-29 11:30,Over 11 Million Brazilians Believe The Earth Is Straight - Somag News
2020-02-29 11:30,Roman Polanski vence prêmio de melhor diretor no César e atrizes se retiram em protesto - Entrelivros
2020-02-29 11:30,"بالصور: ""كورونا"" يقتل لاعبة رياضية ايرانية! - tayyar.org"
2020-02-29 11:30,Great Barrier Reef: coral bleaching to worsen unless weather conditions change - The Guardian
2020-02-29 11:30,"After ""38% Of Americans"" Trends, Corona Beer Says Sales Not Hit By Coronavirus - NDTV News"
2020-02-29 11:30,Η απίθανη χολιγουντιανή έπαυλη που έχει «πιάτο» τη νότια Καλιφόρνια - Newsbeast.gr
2020-02-29 11:30,بعد دخوله المستشفى.. أحمد فلوكس يكشف عن السبب - مصراوي
2020-02-29 11:30,Amazon abre su primer gran supermercado sin cajeros - El Tiempo
2020-02-29 11:30,Japan cherry blossom festivals cancelled as coronavirus fears grow - The Straits Times
2020-02-29 11:30,Primer ministro de Líbano anuncia visitará países del Golfo - Prensa Latina
2020-02-29 11:30,Design Indaba off the chain! - The Patriot Namibia
2020-02-29 11:30,Facebook Desain Ulang Messenger - Okezone
2020-02-29 11:30,LG V60 ThinQ 5G With Dual Screen Announced: Features And Pricing - Techworm
2020-02-29 11:30,2020/2024 National logo and theme in commemoration of Namibia's 30th anniversary launched - nbc.na
2020-02-29 11:30,EEG: Alejandra Baigorria hizo aclaración a Michelle Soifer acerca de su rol de capitana - América Televisión
2020-02-29 11:30,"Quang Hải, Đình Trọng chưa bình phục, nguy cơ lỡ trận tranh siêu cúp - Thể Thao - Tuổi Trẻ Online"
2020-02-29 11:30,"La OMS asegura que el coronavirus ""no es la gripe"": ""Puede ser contenido con medidas adecuadas"" - RPP"
2020-02-29 11:30,Las cinco apuestas del plan de desarrollo de Claudia López - ElTiempo.com
2020-02-29 11:30,Кремний — элемент жизни. Продукты с высоким содержанием кремния повышают иммунитет - SM News
2020-02-29 11:30,ICC Women's T20 World Cup: England's Nat Sciver speaks prior to crucial West Indies clash - Cricket World
2020-02-29 11:30,سوني تدخل عالم السيارات بمركبة جبارة! - Lebanon24
2020-02-29 11:30,Suspenden programa que obliga a solicitantes de asilo esperar en México - Uno TV Noticias
2020-02-29 11:30,Júpiter sigue en cuidados intensivos pero lucha por su vida - Noticias RCN
2020-02-29 11:30,"В Італії померла вже 21 людина із діагностованим коронавірусом, зафіксовано 821 зараження - espreso.tv"
2020-02-29 11:30,"A Junior le pegaron el susto, pero ganó: venció 3-2 a Jaguares - ElTiempo.com"
2020-02-29 11:30,El apoyo a Sanders en Texas se ha duplicado en seis meses impulsado por los hispanos: encuesta Univision - Univision
2020-02-29 11:30,Benzin ve motorinde vergi zammı - Sözcü
2020-02-29 11:30,"Rumour about maid's death due to coronavirus is fake news, says MOH - The Straits Times"
2020-02-29 11:30,David Beckham revela si fichará a Cristiano Ronaldo o Lionel Messi para el Inter Miami - ESPN Deportes
2020-02-29 11:30,【抗暴之戰】防暴清周梓樂祭壇紙鶴「屍橫遍野」 - 香港蘋果日報
2020-02-29 11:30,Midlothian Marathon runner hopes to make it to Tokyo despite looming coronavirus - WTVR CBS 6
2020-02-29 11:30,Científicos trabajan en vacuna contra el coronavirus - Meganoticias
2020-02-29 11:30,"'Mọi người ơi... Tưởng không bị, ai ngờ lại bị'... phạt 10 triệu - Tuổi Trẻ Online"
2020-02-29 11:30,PS5 and Xbox Series X teraflops: What this key spec means for you - Tom's Guide UK
2020-02-29 11:30,Las claves de Roncero para el Clásico de Liga del Bernabéu - Diario AS
2020-02-29 11:30,Erdogan vows to keep doors open for refugees heading to Europe - Business Recorder
2020-02-29 11:30,Campanha de Vacinação contra Gripe será antecipada para ajudar no diagnóstico de Coronavírus - Patos Hoje - Notícias de Patos de Minas
2020-02-29 11:30,Kasus Infeksi Virus Corona di Korsel Tembus 500 Lebih Sehari - SINDOnews.com
2020-02-29 11:30,海南省联合工作组进驻海航集团将协助推进风险化解工作 - 新京报
2020-02-29 11:30,Rise in cost of building houses hits four-year low - Namibian
2020-02-29 11:30,Fresh details emerge about Nigeria's first coronavirus case - Al Jazeera English
2020-02-29 11:30,"Ponsel Black Market Diblokir Mulai April, Simak Ketentuannya - Kompas.com - KOMPAS.com"
2020-02-29 11:30,Italian Infected With Coronavirus Attempts Absconding From Isolation Centre Over Poor Facility - SaharaReporters.com
2020-02-29 11:30,"COVID-19: Hàng loạt nước xuất hiện ca nhiễm đầu tiên, Hàn Quốc có số ca mới cao nhất thế giới - Kênh 14"
2020-02-29 11:30,La Matanza avanza con una inversión inédita en educación - eldestapeweb.com
2020-02-29 11:30,CIMB chief says banking industry will have a challenging year in 2020 - The Edge Markets MY
2020-02-29 11:30,СМИ рассекретили беременность Ксении Собчак — фото - 7Дней.ру
2020-02-29 11:30,"GDC 2020, conferência de desenvolvedores de games, é adiada por causa do coronavírus - G1"
2020-02-29 11:30,Samsung готує до виходу планшет Galaxy Tab S6 Lite зі стилусом та фірмовим процесором Exynos 9611 - Gagadget-Ukraine
2020-02-29 11:30,Роман Полански получил премию «Сезар» как лучший режиссер. Несколько актрис ушли с церемонии награждения в знак протеста - Meduza
2020-02-29 11:30,Medida 191: nuevo engendro de la inútil guerra sicológica - Diario Granma
2020-02-29 11:30,Đại dịch Corona khiến vé máy bay ở Trung Quốc “rẻ như cho” - Dân Trí
2020-02-29 11:30,الزمالك يفوزعلى الترجي ويضع قدماً في نصف نهائي الأبطال - البيان
2020-02-29 11:30,Shah Rukh Khan demonstrates why he is the perfect husband once again - Up News Info
2020-02-29 11:30,"""Йдіть в ср*ку"": відомий український артист брутально відповів на чутки щодо своє розлучення (відео) - Вголос"
2020-02-29 11:30,No Deal from US-Brokered Nile Dam Talks - VOA News
2020-02-29 11:30,Arsenal phải đền tiền vì bị đá khỏi Europa League - Vietnamnet.vn
2020-02-29 11:30,"'Risk is very high,' warns WHO, as coronavirus wipes $6 trillion off markets - Reuters"
2020-02-29 11:30,Марши памяти Бориса Немцова проходят в десятках городов России - BBC Русская служба
2020-02-29 11:30,Астрономи зафіксували найпотужніший спостережуваний вибух у Всесвіті - 24 Канал
2020-02-29 11:30,Diablo 4: principal mudança pode estar em remapear o clique esquerdo - Voxel
2020-02-29 11:30,"Overseas students in South Korea fear prejudice, isolation amid COVID-19 outbreak - CNA"
2020-02-29 11:30,Let's continue to pursue justice for massacred Ghanaians - Grey-Johnson - GhanaWeb
2020-02-29 11:30,Quarantine yourselves if you notice symptoms of Coronavirus – Governor’s forum tells Nigerians - The Punch
2020-02-29 11:30,Entrega de credenciales: 3 congresistas lucieron vestimentas alusivas a su región y profesión - LaRepública.pe
2020-02-29 11:30,Exclusivo: El verdadero motivo por el que Alberto Fernández no se reunirá con Bolsonaro y Lacalle Pou en Uruguay - eldestapeweb.com
2020-02-29 11:30,La perturbadora carta que dejó el joven que murió en los rieles del Metro de Lima | VIDEO - Diario Ojo
2020-02-29 11:30,Muhyiddin Yassin is Malaysia's next prime minister: Palace statement - CNA
2020-02-29 11:30,نجوى كرم تتخطّى 100 مليون مشاهدة بـ ”ملعون أبو العشق“ - mtv.com.lb
2020-02-29 11:30,México pide a la OEA un tercer informe sobre las elecciones en Bolivia - EL PAÍS
2020-02-29 11:30,BWF：不对奥运积分资格做出调整要确保球员安全 - 新浪网
2020-02-29 11:30,تكنولوجيا: Mediatek تُعلن عن شريحة Helio P95 مع ذكاء اصطناعي مُحسن ودعم أفضل للكاميرا - الخليج 365
2020-02-29 11:30,Australia stops travel to coronavirus affected Iran - 9News
2020-02-29 11:30,إصابة ثانية بـ«كورونا»: الأسوأ لم يأتِ بعد؟ - جريدة الأخبار
2020-02-29 11:30,"Врач рассказал, что будет, если пить воду с лимоном натощак - Российская Газета"
2020-02-29 11:30,WHO monitoring Hong Kong dog’s coronavirus tests - South China Morning Post
2020-02-29 11:30,السعودية تعلق دخول مواطني دول الخليج لمكة والمدينة مؤقتاً - العربية
2020-02-29 11:30,CAB to airline firms: Follow travel limits on South Korea - INQUIRER.net
2020-02-29 11:30,Federal appeals court rules against House Democrats' effort to force Don McGahn testimony - Washington Examiner
2020-02-29 11:30,Принц Гаррі та Меган Маркл втратять державну охорону в Канаді - Ракурс
2020-02-29 11:30,Astrônomos detectam a maior explosão do universo desde o Big Bang - Terra
2020-02-29 11:30,"Pep Guardiola se hizo al humilde por elogios de triunfo del City, pero anunció la baja de Laporte en la vuelta - Diario Depor"
2020-02-29 11:30,再增90條產線！日產量上看1300萬片 經濟部喊話：原料供應無虞 - ETtoday
2020-02-29 11:30,Oppo Find X2 live images surface - GSMArena.com news - GSMArena.com
2020-02-29 11:30,"علاء مبارك ينشر فيديو مسجلًا لوالده: ""مصر أمانة في أعناقكم فاحفظوها"" (فيديو) - مصراوي"
2020-02-29 11:30,Recovered COVID-19 patients who test positive for second time are not infectious: China - CNA
2020-02-29 11:30,Significativo aporte de la mujer espirituana a la economía - Escambray
2020-02-29 11:30,剩餘賽事完整剖析：史上最強公鹿真能拿下 70+ 勝嗎？ - 運動視界
2020-02-29 11:30,Coronavirus: South Korea reported more than 800 new cases in a day - Business Insider - Business Insider
2020-02-29 11:30,"Найден разбившийся под Астраханью вертолет, пилот погиб - Интерфакс"
2020-02-29 11:30,VPN nedir? VPN ve DNS değiştirme ile Twitter ve Facebook’a giriş yapılır mı? - Sözcü
2020-02-29 11:30,PS5: patente señalaría que mandos de PlayStation 5 se recargarían inalámbricamente [FOTOS] - LaRepública.pe
2020-02-29 11:30,"Tipo de cambio: Precio del dólar se mantiene alto, ¿a cuánto cerró esta semana? - RPP"
2020-02-29 11:30,الجيش الليبي يحبط أكبر هجوم جوي للوفاق.. 6 طائرات تركية - العربية
2020-02-29 11:30,OMS aumenta riesgo de coronavirus a “muy elevado” | ELESPECTADOR.COM - ElEspectador.com
2020-02-29 11:30,DSÖ açıkladı: Koronavirüse etki edeceğini düşündüğümüz tek bir ilaç var: Remdesivir - Medimagazin
2020-02-29 11:30,"Dólares ""bajo el colchón"", la mejor opción para muchos en Argentina - Panorama.com.ve"
2020-02-29 11:30,Ολυμπιακός : Η δικαίωση της σωστής και μεθοδικής δουλειάς του Μαρτίνς - News.in.gr
2020-02-29 11:30,"В НАТО заявили, что продолжат поддерживать Турцию, в том числе в сфере ПВО - ТАСС"
2020-02-29 11:30,iPad Pro 2020 Could Launch With Accessory To Fix iPad’s Biggest Problem - Forbes
2020-02-29 11:30,"La última teoría de Maduro: dice que coronavirus podría ser ""arma de guerra contra China"" - Pulzo"
2020-02-29 11:30,"Clasico! Real Madrid vs Barcelona: Preview, Kabar Terkini Skuad, Prediksi & Jadwal TV - Goal.com"
2020-02-29 11:30,"Com motosserra, deputado de Roraima derruba bloqueio em terra indígena - CartaCapital"
2020-02-29 11:30,Coronavirus COVID-19 risk increased to 'very high' but containment still possible - UN News
2020-02-29 11:30,Giá xăng dầu lại đồng loạt giảm từ chiều nay - Báo Thanh Niên
2020-02-29 11:30,Eurodiputados visitan proyectos de desarrollo económico de Cuba - Prensa Latina
2020-02-29 11:30,義大利確診衝破600人！全場反揭「暴增主因」：不敢想像| 武漢包機返台風波 - NOWnews
2020-02-29 11:30,Quốc vương Malaysia bổ nhiệm cựu bộ trưởng nội vụ làm thủ tướng mới - Tuổi Trẻ Online
2020-02-29 11:30,"Beccacece: ""Tenemos que mejorar y... - Racing de Alma"
2020-02-29 11:30,الجامعة الأميركية الإمتحانات المقررة ستُجرى في موعدها - tayyar.org
2020-02-29 11:30,Trader Joe's founder Joe Coulombe dies at 89 - NBC News
2020-02-29 11:30,Facebook canceling F8 could mean bad news for an Apple event - iMore
2020-02-29 11:30,Khử khuẩn ngôi nhà có người tử vong chưa rõ nguyên nhân tại Hà Nội - Báo Thanh Niên
2020-02-29 11:30,Sheikh Rashid requests CM Sindh to abolish unmanned railway crossings - Geo News
2020-02-29 11:30,Konkurs drużynowy Pucharu Świata w Lahti. Gdzie i o której obejrzeć? - Sport.pl
2020-02-29 11:30,Masterchef: Ποιος αποχώρησε την Παρασκευή - Τηλεόραση | News 24/7 - NEWS 24/7
2020-02-29 11:30,"Эксперты объяснили, почему коронавирус в Китае в 100 раз мощнее ТОРС - Goroday"
2020-02-29 11:30,Jürgen Klopp's Watford analysis - Liverpool FC
2020-02-29 11:30,"Altın fiyatları 29 Şubat 2020… Çeyrek altın ne kadar, gram altın kaç lira? - CNN Türk"
2020-02-29 11:30,"Singapore president, ministers to take 1-month pay cut over virus - Free Malaysia Today"
2020-02-29 11:30,La peor semana para los mercados financieros desde la crisis de 2008 en medio de temores por el coronavirus - CNN
2020-02-29 11:30,Walt Disney closes all theme parks in Asia on coronavirus concerns - AsiaOne
2020-02-29 11:30,武漢肺炎／單日增5名確診 4例院內群聚1例境外移入 - 中央社即時新聞
