datetime,headline
2020-02-28 21:05,White House: 'Media stoking virus fears to take down Trump' - BBC News
2020-02-28 21:05,House Dems Say They're Looking Into Political Influence At Justice Department - NPR
2020-02-28 21:05,These are the democratic socialists backing Bernie Sanders - CNN
2020-02-28 21:05,"Driver crashes BMW through Pennsylvania day care, 5 children injured - NBC News"
2020-02-28 21:05,"As Iran's Leaders Contract Coronavirus, Doubts Emerge Over National Tally - Wall Street Journal"
2020-02-28 21:05,Chairman Jerome Powell says Fed ready to protect economy amid coronavirus fears - Washington Examiner
2020-02-28 21:05,Coronavirus fears send global markets into freefall | DW News - DW News
2020-02-28 21:05,"Wall Street's 'fear gauge' jumps to highest level in 2 years, on pace for biggest weekly gain in its history as stocks tumble - MarketWatch"
2020-02-28 21:05,"Coronavirus: From Facebook’s F8 to Mobile World Congress, here are all the major tech conferences canceled - Vox.com"
2020-02-28 21:05,Microsoft drops Cortana consumer skills in new Windows 10 update - The Verge
2020-02-28 21:05,‘Shark Tank’ star Barbara Corcoran gets back almost $400K after scam - Page Six
2020-02-28 21:05,Lady Gaga’s Message Remains Clear on ‘Stupid Love’: Just Dance - Vulture
2020-02-28 21:05,Harvey Weinstein Juror Speaks Out: #MeToo Movement Played No Role; Deliberations Not Divided On Gender Lines - Deadline
2020-02-28 21:05,What they're saying about Justin Herbert after the NFL Combine - 247Sports
2020-02-28 21:05,"Harden's right, Giannis doesn't have a lot of skill, talks Burrow & Tua draft — Gottlieb | THE HERD - The Herd with Colin Cowherd"
2020-02-28 21:05,Jim Walmsley is America’s best ultra runner. Why is he racing the U.S. Olympic Marathon Trials? - NBC Sports - Misc.
2020-02-28 21:05,Physicist And Iconoclastic Thinker Freeman Dyson Dies At 96 - NPR
2020-02-28 21:05,WHO declares rest of the world at 'very high' risk for coronavirus - MarketWatch
2020-02-28 21:05,The costs of secrecy - Science Magazine
2020-02-28 21:05,Watch live: World Health Organization holds press conference on the coronavirus outbreak - CNBC
2020-02-28 21:05,California monitoring 8400 people for coronavirus - CBS This Morning
2020-02-28 22:05,Federal appeals court rules against Trump in two major immigration cases - NBC News
2020-02-28 22:05,Mike Bloomberg says he's running for president until 'the bitter end' - New York Post
2020-02-28 22:05,House Votes to Ban Flavors in Cigarettes and E-Cigarettes - The New York Times
2020-02-28 22:05,"Bernie Sanders holds 2-1 lead in California primary, poll says - Los Angeles Times"
2020-02-28 22:05,Nato expresses 'full solidarity' with Turkey over Syria airstrikes - The Guardian
2020-02-28 22:05,Paris Gare de Lyon: Fire at station amid DR Congo concert protest - BBC News
2020-02-28 22:05,Stocks record worst week since financial crisis as coronavirus concerns heat up - MarketWatch
2020-02-28 22:05,Federal Reserve must quickly stop coronavirus stock market crash: trader - Yahoo Finance
2020-02-28 22:05,The S&P 500 is plunging at unprecedented speed - CNN
2020-02-28 22:05,Apple has blocked Clearview AI’s iPhone app for violating its rules - TechCrunch
2020-02-28 22:05,"The Games Of PAX East 2020 -- Animal Crossing, Doom Eternal, Streets Of Rage 4, Magic: Legends, And More - GameSpot"
2020-02-28 22:05,Disney’s massive media empire leads to Simpsons short with Pixar’s Onward - The Verge
2020-02-28 22:05,"Elisabeth Moss Said ""The Invisible Man"" Is A ""Pretty Gigantic, Obvious Analogy"" For Gaslighting - BuzzFeed News"
2020-02-28 22:05,Kaboom! Astronomers detect the universe's biggest explosion since the Big Bang - USA TODAY
2020-02-28 22:05,Up to a HUNDRED health workers were exposed to the undiagnosed coronavirus patient - Daily Mail
2020-02-28 22:05,The best prevention against the coronavirus is still washing your hands. Here's the proper way to do it - CNN
2020-02-28 23:05,Donald Trump Jr. Says Democrats Hope Coronavirus Will Kill Americans - Newsweek
2020-02-28 23:05,Trump wins appeal to block McGahn testimony - POLITICO
2020-02-28 23:05,CNN polls: Bernie Sanders holds big leads in California and Texas ahead of critical Super Tuesday vote - CNN
2020-02-28 23:05,"Mark Levin slams Schumer, Pelosi as 'the last people I want playing doctor with me or the American people' - Fox News"
2020-02-28 23:05,Appeals court halts Trump policy requiring asylum-seekers to wait in Mexico | TheHill - The Hill
2020-02-28 23:05,House approves bill to ban the sale of flavored e-cigarettes - Fox News
2020-02-28 23:05,Paris police evacuate Gare de Lyon train station after fire broke out - The Telegraph
2020-02-28 23:05,US stock markets continue to plunge over coronavirus uncertainty l ABC News Special Report - ABC News
2020-02-28 23:05,Stocks fall sharply on Wall Street; Dow Jones sinks 3.8% - KSL.com
2020-02-28 23:05,Trump says he hopes the Fed gets involved 'soon' to combat market sell-off from coronavirus - CNBC
2020-02-28 23:05,Samsung Galaxy Tab S6 Lite leak reveals an affordable Android tablet with an S Pen - Android Central
2020-02-28 23:05,Daily Crunch: Facebook cancels F8 over coronavirus concerns - TechCrunch
2020-02-28 23:05,Ranking All Mainline Final Fantasy Games From Worst To Best - GamingBolt
2020-02-28 23:05,Singer Normani rips Camila Cabello’s racist Tumblr posts - New York Daily News
2020-02-28 23:05,49ers meet with speedy Bama receiver Ruggs at combine - NBCSports.com
2020-02-28 23:05,"Katherine Johnson, pioneering Nasa mathematician, 1918-2020 - Financial Times"
2020-02-28 23:05,California woman with 'unknown origin' coronavirus case in serious condition - New York Post
2020-02-28 23:05,"After missteps, CDC says its coronavirus test kit is ready for primetime - NBCNews.com"
2020-02-29 00:06,Trump says he will nominate Rep. John Ratcliffe to be director of national intelligence - CNN
2020-02-29 00:06,"Congress Cannot Sue to Enforce Subpoenas Defied by Executive Branch, Appeals Court Rules - The New York Times"
2020-02-29 00:06,"Pence tells Rush Limbaugh, who said coronavirus has been overhyped: 'We're all in this together' - NBCNews.com"
2020-02-29 00:06,Republicans storm out of coronavirus briefing after Democrat rips Trump's response - POLITICO
2020-02-29 00:06,"NATO urges Russia, Turkey to halt Idlib attacks - Al Jazeera English"
2020-02-29 00:06,Coronavirus in Iran prompts US to extend olive branch amid claim country's death toll far higher than reported - Fox News
2020-02-29 00:06,Stock Market Plunge Delivers Worst Week For Wall Street Since 2008 - HuffPost
2020-02-29 00:06,Virus sell-off hands S&P 500 biggest drops at the opening bell - Financial Times
2020-02-29 00:06,Powell Opens Door to Fed Rate Cut on ‘Evolving’ Risks From Virus - Bloomberg
2020-02-29 00:06,Exclusive: Hands-on with Huawei’s unreleased P40 Series - Digital Trends
2020-02-29 00:06,"Roman Polanski Wins Best Director at France’s Cesar Awards, Prompting Walkouts - Variety"
2020-02-29 00:06,"Sad Harvey Weinstein confused by verdict, spending time reading Churchill - Page Six"
2020-02-29 00:06,Tennessee Titans have met with 4 2020 NFL Draft prospects at combine - Titans Wire
2020-02-29 00:06,James Harden vs. Giannis Antetokounmpo Is the NBA’s Latest Beef - The Ringer
2020-02-29 00:06,Tom Brady Drops Encouraging Comment On N’Keal Harry’s Latest Instagram - NESN
2020-02-29 00:06,"Henry Ruggs Separates Himself, Justin Herbert and Jalen Hurts Impress, More Combine Notes - Sports Illustrated"
2020-02-29 00:06,"Boeing's Starliner spacecraft is built to carry astronauts, but safety concerns loom - CNN"
2020-02-29 00:06,"After missteps, CDC says its coronavirus test kit is ready for primetime - NBC News"
2020-02-29 00:06,Santa Clara County Confirms New Case of Coronavirus - NBC Bay Area
2020-02-29 01:05,Appeals court says Don McGahn doesn't have to testify in major win for White House - CNN
2020-02-29 01:05,"Live updates: Second coronavirus case of unknown origin confirmed in California, indicating virus is spreading in the state - The Washington Post"
2020-02-29 01:05,Democratic Rivals Are Fighting Over Obama. He Has Some Opinions. - The New York Times
2020-02-29 01:05,CTA train shooting: Man shot by police at the Red Line’s Grand station - Chicago Sun-Times
2020-02-29 01:05,"Pence tells Limbaugh he believes Indiana work on HIV, MERS part of reason Trump tapped him on coronavirus | TheHill - The Hill"
2020-02-29 01:05,'Help me get it.' Pete Buttigieg's black surrogates face a skeptical audience for the candidate in South Carolina - USA TODAY
2020-02-29 01:05,"Ten pressing questions about coronavirus, answered by experts - The Boston Globe"
2020-02-29 01:05,Coronavirus: Risk of spread upgraded to highest level - BBC News
2020-02-29 01:05,Game Developers Conference canceled as tech conferences keep falling as fast as the stock market - MarketWatch
2020-02-29 01:05,Facebook’s 3D photos can now be made using single-camera phones - The Verge
2020-02-29 01:05,Normani 'hurt' by Camila Cabello's social media behavior - Los Angeles Times
2020-02-29 01:05,"Roman Polanski Wins Best Director at France’s Cesar Awards, ‘Les Miserables’ Wins Best Picture - Variety"
2020-02-29 01:05,"‘Hawaii Five-0’ To End After 10 Seasons On CBS, Sets Two-Hour Series Finale - New York Post"
2020-02-29 01:05,Ben Affleck 'had a breakdown' filming new movie when his character makes amends to wife: 'It was obviously real' - Yahoo Entertainment
2020-02-29 01:05,Offensive Linemen Run the 40-Yard Dash at the 2020 NFL Scouting Combine - NFL
2020-02-29 01:05,Wisconsin Badgers football: What Quintez Cephus’ mixed NFL Combine really means - Bucky's 5th Quarter
2020-02-29 01:05,"LA deputies shared graphic photos of Kobe Bryant crash scene, report says - The Guardian"
2020-02-29 01:05,Physicists model the supernovae that result from pulsating supergiants like Betelgeuse - Phys.org
2020-02-29 01:05,Boeing says thorough testing would have caught Starliner software problems - Spaceflight Now
2020-02-29 01:05,"Novel coronavirus outbreak: Additional COVID-19 cases confirmed in Solano and Santa Clara County, officials say - KGO-TV"
2020-02-29 01:05,CDC Defends Its Handling Of New Coronavirus Case In California - NPR
2020-02-29 01:05,The Coronavirus Stock Market Rollercoaster Isn't Stopping Anytime Soon - The Daily Beast
