datetime,headline
2020-02-28 06:28,Bloomberg says he nearly eliminated stop-and-frisk as mayor. But he fought for it to the end. - NBC News
2020-02-28 06:28,'Voters themselves must pick': Why Barack Obama isn't endorsing Joe Biden or anyone else for president - USA TODAY
2020-02-28 06:28,"Black History Month: First grade teacher dresses up as a different black trailblazer every day of February, in Suffolk, Virginia - CBS News"
2020-02-28 06:28,2020 Democrats Fight To The Finish In South Carolina | NBC Nightly News - NBC News
2020-02-28 06:28,"Coronavirus Live Updates: Cases Soar in Italy, Iran and South Korea as Alarm Grows - msnNOW"
2020-02-28 06:28,Coronavirus in Florida: How to be prepared - Sun Sentinel
2020-02-28 06:33,Molson Coors shooting victims identified - CBS Evening News
2020-02-28 06:33,29 Turkish soldiers killed by airstrike in northeastern Syria - CBS News
2020-02-28 06:33,"Alabama's Henry Ruggs runs 4.27 in 40-yard dash, short of John Ross' record - Yahoo Sports"
2020-02-28 07:05,"Coronavirus live updates: New Zealand reports first case, Tokyo Disneyland shuts down - CNBC"
2020-02-28 07:05,Why 2020 is the 'meme election' - CNN
2020-02-28 07:05,"Body, casket recovered after stolen hearse crashes to end Los Angeles chase - NBC News"
2020-02-28 07:05,Coronavirus anxiety triggers biggest 1-day stock market drop since 2011 - AL.com
2020-02-28 07:05,Pandemic sim Plague Inc. pulled from Chinese app stores - Polygon
2020-02-28 07:05,The Invisible Man Ending Explained: What Really Happened To Adrian Griffin? - CinemaBlend
2020-02-28 07:05,Dez Bryant excited after Jerry Jones admits to thinking 'in the shower' about bringing WR back to Cowboys - Yahoo Sports
2020-02-28 07:05,Coronavirus update: China's outbreak concerns ease as the rest of the world's grow more acute - Yahoo Finance
2020-02-28 08:06,Coronavirus Live Updates: W.H.O. Warns Outbreak Has ‘Pandemic Potential’ - The New York Times
2020-02-28 08:06,Pence tells 'Hannity' risk of coronavirus spread in US 'remains low' thanks to Trump's 'decisive action' - Fox News
2020-02-28 08:06,Trump Holds Press Conference On Coronavirus | NBC News (Live Stream Recording) - NBC News
2020-02-28 08:06,Dramatic rescues unfold after water main break floods Houston - CBS News
2020-02-28 08:06,San Francisco police arrest suspect in filmed attack of Asian man collecting recyclables - NBC News
2020-02-28 08:06,33 Turkish soldiers killed in Syrian air raid in Idlib - Al Jazeera English
2020-02-28 08:06,Here’s Why This Is Not A Stock Market Dip You Want To Buy - CCN.com
2020-02-28 08:06,Markets head for worst week since 2008 as coronavirus cases surge - Aljazeera.com
2020-02-28 08:06,Pandemic simulation game 'Plague Inc' pulled from China's App Store - Mashable
2020-02-28 08:06,"The 'Grey's Anatomy' Season 16, Episode 16 Promo Trailer Bids Farewell to Alex Karev and Fans Are Already Crying - Showbiz Cheat Sheet"
2020-02-28 08:06,"South Korean boy band BTS cancels some concerts in Seoul, citing coronavirus outbreak - CNBC"
2020-02-28 08:06,NFL Scouting Combine Notebook: Is Henry Ruggs Too Fast for His Own Good? - Bleacher Report
2020-02-28 08:06,"Will Northern California schools close, cancel trips in response to Sacramento coronavirus case? - Sacramento Bee"
2020-02-28 08:06,"Coronavirus spreads faster outside China, stoking global fears - ARIRANG NEWS"
2020-02-28 08:06,CDC: A clean shave lowers coronavirus chances when wearing a mask - The Denver Channel
2020-02-28 09:05,Laura Ingraham debunks 'biggest lies' levied at Trump administration over coronavirus response - Fox News
2020-02-28 09:05,Coronavirus spreads in three continents; markets brace for global recession - Reuters
2020-02-28 09:05,Massive Houston water main break floods roadways; water advisories in effect - Fox News
2020-02-28 09:05,The Superdelegates Are Nervous - The New York Times
2020-02-28 09:05,How Americans can prepare for coronavirus if it spreads here - ABC News
2020-02-28 09:05,New Delhi riots leave 38 dead as India balks at U.S. reaction to the religious violence - CBS News
2020-02-28 09:05,U.S. stock futures point to further sharp declines as Asia follows Wall Street plunge - MarketWatch
2020-02-28 09:05,China's Top Container Ports Unclog Backlog as Virus Curbs Ease - gcaptain.com
2020-02-28 09:05,Google Fi already using T-Mobile’s 5G network on supported phones - 9to5Google
2020-02-28 09:05,Lady Gaga Fights for Compassion in ‘Stupid Love’ Video - Rolling Stone
2020-02-28 09:05,I Want Megan Thee Stallion to Give Me a Pep Talk - The Cut
2020-02-28 09:05,"Stefon Diggs, Other NFL Stars Come Out Against Proposed CBA - Sports Illustrated"
2020-02-28 09:05,"Deputies shared graphic photos of Kobe Bryant crash scene, sources say - Los Angeles Times"
2020-02-28 09:05,Astronomers detect biggest explosion since Big Bang - DW (English)
2020-02-28 09:05,Mask shortage in Sacramento as coronavirus fears grip California. What protection is available - Sacramento Bee
2020-02-28 09:05,Coronavirus update: China's outbreak concerns ease as the rest of the world's grow more acute - Yahoo News
2020-02-28 09:05,"Global National: Feb. 27, 2020 | Coronavirus has ""pandemic potential"" as cases rise globally - Global News"
2020-02-28 09:05,"Study: 3 cases of massive LSD dosing, including woman who snorted 550 times the usual amount, resulted in more good than harm - KTLA"
2020-02-28 10:05,Live updates: Coronavirus pummels financial markets; Japanese island declares state of emergency - The Washington Post
2020-02-28 10:05,Bloomberg says he will run 'right to the bitter end' if nomination not locked up - NBC News
2020-02-28 10:05,Trump blames stock market dip on Democrats at coronavirus news conference - Vox.com
2020-02-28 10:05,Bernie Sanders supporters react to report saying Democratic Party trying to sabotage him: 'It's trash' - Fox News
2020-02-28 10:05,Education department says USC failed to protect students from ex-school gynecologist - Fox News
2020-02-28 10:05,U.S. stock futures sink as coronavirus fears set to drive deeper selloff - MarketWatch
2020-02-28 10:05,The 10-year US Treasury yield falls to record low as coronavirus sends investors fleeing to safety - Business Insider
2020-02-28 10:05,Vivo Apex 2020 announced: Specs and features - Android Authority
2020-02-28 10:05,"2020 election: Gmail favouring certain electoral candidates over others, research suggests - The Independent"
2020-02-28 10:05,"Forget Samsung's Galaxy S20, This Is The Smartphone To Buy - Forbes"
2020-02-28 10:05,"Harvey Weinstein juror: ""There was nothing simple"" about decision - CBS News"
2020-02-28 10:05,"Netflix's 'Love is Blind': Which couples got married, split on TV? - USA TODAY"
2020-02-28 10:05,"Plácido Domingo Backpedals On Public Apology; Meanwhile, Union Seeks Leakers - NPR"
2020-02-28 10:05,"Sun Yang, Chinese Olympic Swimmer, Gets 8-Year Doping Ban - The New York Times"
2020-02-28 10:05,"Astronomy student discovers 17 new planets, including Earth-sized world - EurekAlert"
2020-02-28 10:05,How will the coronavirus outbreak end? - Livescience.com
2020-02-28 10:05,"California patient with unknown origin of coronavirus is in serious condition, official says - CNN"
2020-02-28 10:05,How deadly is the new coronavirus? Who's most at risk? - KOCO Oklahoma City
2020-02-28 11:05,"China no longer world's 'greatest concern' amid coronavirus crisis, WHO says - New York Post"
2020-02-28 11:05,Pope Sick After Voicing Support for Coronavirus Patients - Inside Edition
2020-02-28 11:05,"After dozens of Native American women disappear, families seek action - CNN"
2020-02-28 11:05,Hong Kong pro-democracy media mogul Jimmy Lai arrested for 'illegal assembly' over 2019 protest - CNN
2020-02-28 11:05,"Coronavirus live updates: COVID-19 disease reaches 50 countries, including 1st in sub-Saharan Africa - CBS News"
2020-02-28 11:05,Stocks Plunge Amid Coronavirus Fears - TPM
2020-02-28 11:05,U.S. stock futures sink as coronavirus fears set to drive a deeper selloff - MarketWatch
2020-02-28 11:05,"China bans mobile game about pandemics, which should fix everything - The A.V. Club"
2020-02-28 11:05,"WeWork’s fall is so wild that it’s getting a second TV series, this one for Apple - The Verge"
2020-02-28 11:05,Report | Tyson Fury vs. Deontay Wilder 2 PPV falls under the ‘break-even’ point - BJPenn.com
2020-02-28 11:05,Triple Olympic champion Sun Yang handed eight-year ban - CNN International
2020-02-28 11:05,"Astronomy student discovers 17 new planets, including Earth-sized world - Phys.org"
2020-02-28 11:05,"Coronavirus cases are literally popping up out of nowhere, which is terrifying - BGR"
2020-02-28 11:05,Global stocks head for worst week since the financial crisis amid fears of a possible pandemic - CNBC
2020-02-28 11:05,Investment Advisors Worry U.S. Response To Coronavirus Is Too Little Too Late - HuffPost
2020-02-28 12:06,Joe Biden's Campaign Is On The Line In South Carolina - NPR
2020-02-28 12:06,Trump seeks a 'miracle' as virus fears mount - CNN
2020-02-28 12:06,"Coronavirus Live Updates: World Reaches ‘Decisive Point’ in Outbreak Fight, W.H.O. Says - The New York Times"
2020-02-28 12:06,Pope Francis sick a day after supporting coronavirus sufferers - New York Post
2020-02-28 12:06,Late Night Awaits Mike Pence’s Cure for the Coronavirus - The New York Times
2020-02-28 12:06,Russia denies responsibility for attack in northern Syria that killed 33 Turkish soldiers - The Washington Post
2020-02-28 12:06,What to know about the coronavirus | TheHill - The Hill
2020-02-28 12:06,US says Chinese warship fired military laser at US aircraft - CNN
2020-02-28 12:06,Dow Futures Extend Slump Amid Worst Stock Market Slide Since Global Financial Crisis - TheStreet
2020-02-28 12:06,Dow is set to tank again after Thursday's massive tumble on coronavirus fears - msnNOW
2020-02-28 12:06,Coronavirus crash wipes $5 trillion off world stocks - NBC News
2020-02-28 12:06,"Samsung Galaxy Note 10 update tweaks gesture navigation, face unlock - PhoneArena"
2020-02-28 12:06,Lady Gaga Talks 'Stupid Love' And New Album - Billboard
2020-02-28 12:06,NFL Draft Combine: Punter Michael Turk outperforms some Pro Bowl defensive linemen with 25 bench press reps - CBS Sports
2020-02-28 12:06,Astronomers detect biggest explosion since Big Bang - Deutsche Welle
2020-02-28 12:06,Scientists discover first animal that can survive without oxygen - New York Post
2020-02-28 12:06,US CDC confirms first coronavirus case of unknown origin - The Straits Times
2020-02-28 12:06,"12 Myths About Coronavirus, According to the World Health Organization - msnNOW"
2020-02-28 13:05,Pope cancels visit with Rome priests for ‘slight’ illness - Crux: Covering all things Catholic
2020-02-28 13:05,US students lag other countries in math. The reason likely lies in how schools teach it. - USA TODAY
2020-02-28 13:05,"AP fact-checkers find Biden, Bloomberg paint 'distorted picture' on Trump CDC funding | TheHill - The Hill"
2020-02-28 13:05,Turkey Vows to Resist Attacks Against Its Forces in Syria - The New York Times
2020-02-28 13:05,"Chinese ship fired laser at American P-8A Poseidon aircraft, Navy says - CBS News"
2020-02-28 13:05,Breakingviews - Breakdown: Coronavirus goes global - Reuters
2020-02-28 13:05,How Netanyahu may win reelection despite corruption charges - CNN
2020-02-28 13:05,Samsung Galaxy S20 sales down 50% compared to the Galaxy S10 - PocketNow
2020-02-28 13:05,Dear Apple: don’t let a trackpad turn the iPad into a Mac - The Verge
2020-02-28 13:05,Timex Ironman R300 GPS is a $120 smartwatch with epic battery life - Pocket-lint
2020-02-28 13:05,Arizona State punter Michael Turk steals show at NFL Combine - New York Post
2020-02-28 13:05,Possible 'mini-moon' orbiting Earth spotted by Tucson astronomers - ABC15 Arizona
2020-02-28 13:05,This Parasite Doesn’t Need Oxygen to Survive - The New York Times
2020-02-28 13:05,CDC and State Department officials Testify to House Committee on Global Coronavirus Response - QuickTake by Bloomberg
2020-02-28 13:05,UC Davis student showing ‘mild symptoms’ of coronavirus. 3 roommates in isolation - Sacramento Bee
2020-02-28 14:05,GOP scramble is on to succeed Donald Trump in 2024 - POLITICO
2020-02-28 14:05,"US workers didn't have proper gear to work with coronavirus evacuees, HHS whistleblower claims - USA TODAY"
2020-02-28 14:05,"Pope Francis remains sick, cancels Friday audiences - New York Post"
2020-02-28 14:05,Turkey-Syria tensions escalate after troops killed: Live updates - Al Jazeera English
2020-02-28 14:05,Fox News Exclusive: Pence says risk of coronavirus spread in US 'low' thanks to Trump; Biden probe in Ukraine - Fox News
2020-02-28 14:05,4 kids recovering from injuries after a car slammed into day care in Philadelphia - ABC News
2020-02-28 14:05,Geneva car show axed; coronavirus wipes $5 trillion off world markets - Reuters
2020-02-28 14:05,Geneva Motor Show canceled over coronavirus fears - Engadget
2020-02-28 14:05,iPhone 11 Was the Second-Best-Selling Smartphone for 2019 Despite Launching in the Second Half of the Year - Wccftech
2020-02-28 14:05,Dear passwords: Forget you. Here's what is going to protect us instead - USA TODAY
2020-02-28 14:05,Jessica and Mark's Dynamic Following 'Love Is Blind' Is Exactly What You Would Expect - Showbiz Cheat Sheet
2020-02-28 14:05,Harvey Weinstein starts work on appeal from New York hospital - The Guardian
2020-02-28 14:05,UFC Norfolk: Challenger vs Challenger - UFC - Ultimate Fighting Championship
2020-02-28 14:05,"For 16-year-old black girl nerds, it’s good that Katherine Johnson is no longer hidden - Washington Post"
2020-02-28 14:05,"As coronavirus anxiety builds, N.J. schools prepare for an outbreak - NJ.com"
2020-02-28 14:05,NCSU economist: Coronavirus could take down the economy – here's how - WRAL Tech Wire
2020-02-28 15:05,Trump says Democrats are blaming him for coronavirus - POLITICO
2020-02-28 15:05,Election 2020 live updates: Democrats make final arguments in South Carolina - The Washington Post
2020-02-28 15:05,"Coronavirus live updates: US workers didn't have proper gear to work with evacuees, whistleblower says - USA TODAY"
2020-02-28 15:05,"Pelosi, Trying to Save House Majority, Fends Off Angst Over Sanders - The New York Times"
2020-02-28 15:05,Pope Francis cancels Mass over 'slight' illness amid Italy coronavirus outbreak - South China Morning Post
2020-02-28 15:05,"Working Families' Party, progressive groups plan #NeverBloomberg campaign, march on candidate's home | TheHill - The Hill"
2020-02-28 15:05,"Turkey, Pressing E.U. for Help in Syria, Threatens to Open Borders to Refugees - The New York Times"
2020-02-28 15:05,Indian police detain hundreds after Hindu-Muslim clashes in New Delhi - Reuters
2020-02-28 15:05,Heathrow Airport Runway Plan Blocked Over Climate Commitments - NPR
2020-02-28 15:05,5 things to know before the stock market opens Friday - CNBC
2020-02-28 15:05,"Leap Day brings free food and specials Feb. 29, along with exclusive deals for Leaplings - USA TODAY"
2020-02-28 15:05,"Snap AV: S&P slump fastest correction ever, says Deutsche - Financial Times"
2020-02-28 15:05,"Sorry, Razr and Galaxy Z Flip: Foldable phones still need a win - CNET"
2020-02-28 15:05,Ben Affleck suffered 'breakdown' on set while portraying alcoholic who apologizes to wife in 'The Way Back' - Fox News
2020-02-28 15:05,"Stock up, stock down: Eagles WR targets after NFL Combine testing - PhillyVoice.com"
2020-02-28 16:05,The case for Bernie Sanders - Vox
2020-02-28 16:05,"Main Street leans toward Sanders, but Wall Street says Trump - Reuters"
2020-02-28 16:05,Pence's handling of 2015 HIV outbreak gets new scrutiny - NBCNews.com
2020-02-28 16:05,"Coronavirus Update, Map As More Than 4,000 People Infected Outside China in Over 50 Countries - Newsweek"
2020-02-28 16:05,Malaysia's economy could miss out on a much-needed boost because it has no government - CNBC
2020-02-28 16:05,"Dow drops 800 at open, extending worst week since financial crisis - MSNBC"
2020-02-28 16:05,Coronavirus fears trigger stock 'correction.' Here's what that means. - Chicago Tribune
2020-02-28 16:05,"Leap year deals, freebies to take advantage of on Saturday - KSAT San Antonio"
2020-02-28 16:05,Samsung Galaxy Z Flip review—I think I hate flip phones - Ars Technica
2020-02-28 16:05,"Interview: Harry Styles On 'Fine Line,' Stevie Nicks, Life After One Direction - NPR"
2020-02-28 16:05,Lady Gaga drops out of this world video for new single 'Stupid Love' - CNN
2020-02-28 16:05,"2020 NFL combine - Offensive linemen, running backs work out Friday - ESPN"
2020-02-28 16:05,Case made for Jarrett Stidham to replace Tom Brady if he leaves Patriots - New York Post
2020-02-28 16:05,Biggest explosion since the Big Bang spotted by astronomers - physicsworld.com
2020-02-28 16:05,Coronavirus outbreak: World Health Organization gives latest update on virus | LIVE - Global News
2020-02-28 17:06,Donald Trump Jr. just said something unreal about Democrats and the coronavirus - CNN
2020-02-28 17:06,WHO increases coronavirus risk to 'very high'; whistleblower says US workers weren't ready for evacuees - USA TODAY
2020-02-28 17:06,"Sen. Lindsey Graham: Biden will win SC primary 'by double digits,' but Dem nomination is Bernie's to lose - Fox News"
2020-02-28 17:06,"Bernie Sanders Overtakes Joe Biden in Fox News Poll For First Time, Opens Seven-Point Lead Over Trump - Newsweek"
2020-02-28 17:06,WHO raises coronavirus threat assessment to its highest level: 'Wake up! Get ready! This virus may be on its way' - CNBC
2020-02-28 17:06,Sen. Tim Kaine endorses Joe Biden before key primary elections - The Washington Post
2020-02-28 17:06,Pence is leading the coronavirus response but he's still heading to Florida to fundraise - CNN
2020-02-28 17:06,"Biden reverses course, admits he didn’t get arrested in South Africa - Fox News"
2020-02-28 17:06,NATO Meets After Turkey Says Russian-Backed Force Killed 33 Troops In Syria - NPR
2020-02-28 17:06,Dow Hurtles Toward Bear Market as Coronavirus Pummels U.S. Stocks - CCN.com
2020-02-28 17:06,A Delhi neighborhood divided by a highway and now hatred - Reuters
2020-02-28 17:06,China pointed weapons-grade laser at US surveillance aircraft: Navy - Washington Examiner
2020-02-28 17:06,S&P 500 Futures Fall on U.S. Virus Case Without Outbreak Ties - Investing.com
2020-02-28 17:06,Gold price remains under pressure as PCE inflation remains muted - Kitco NEWS
2020-02-28 17:06,United Airlines slashes Asia service because of coronavirus - CNBC
2020-02-28 17:06,MI5 Argues for 'Exceptional Access' to Encrypted Messages - MacRumors
2020-02-28 17:06,Livin' on an Heir: Prince Harry and Jon Bon Jovi jam at Abbey Road - CNN
2020-02-28 17:06,Harvey Weinstein juror says verdict was not meant to be a message about the #MeToo movement - CBS News
2020-02-28 17:06,‘Love Is Blind’ duo Lauren and Cameron tell us what it was really like inside those pods - The Washington Post
2020-02-28 17:06,"The Last Duel Set Photos Reveal Matt Damon, Ben Affleck & Adam Driver - ComingSoon.net"
2020-02-28 17:06,2020 NFL Draft: Jacob Eason struggling with Combine interviews - With the First Pick
2020-02-28 17:06,"Why Patriots Should Wait On QB, Take Jalen Hurts In Middle Of NFL Draft - NESN"
2020-02-28 17:06,Chinese swimmer Sun Yang gets 8-year ban for doping offences - South China Morning Post
2020-02-28 17:06,"UFC on ESPN+ 27 weigh-in results: Two fighters overweight, including a headliner - MMA Junkie"
2020-02-28 17:06,Why the Silent Spread of Coronavirus Might Actually Be a Good Sign - Slate
2020-02-28 17:06,This Is How The CDC Thinks The Coronavirus Might Spread - IFLScience
2020-02-28 18:05,Rep. Jim Clyburn says Democrats are concerned about 'down-ballot carnage' - CNN
2020-02-28 18:05,"Media Covering Coronavirus to ‘Bring Down the President,’ Mulvaney Claims - The New York Times"
2020-02-28 18:05,Post-debate poll: Viewers say Bernie Sanders made best case that he could beat Trump - CBS News
2020-02-28 18:05,"If coronavirus spreads within the US, here's how daily life might change - WPBF West Palm Beach"
2020-02-28 18:05,Goldman expects three Fed rate cuts starting in March to offset coronavirus damage - CNBC
2020-02-28 18:05,"Stocks, Dow Sink As Coronavirus Fears Continue Driving Economic Uncertainty - HuffPost"
2020-02-28 18:05,The Jabra Elite 65t true wireless earbuds tie their all-time low: $90 - CNET
2020-02-28 18:05,Report identifies the most dangerous mobile app store on the internet - ZDNet
2020-02-28 18:05,'Love Is Blind': Jessica Answers If She's an Alcoholic and Explains Why She Drank so Much - Showbiz Cheat Sheet
2020-02-28 18:05,Speculation abounds around Tom Brady's future as NFL free agency approaches - CNN International
2020-02-28 18:05,"UFC Fight Night 169 Weigh-in Results: Figueiredo Misses Weight, Only Benavidez Can Win Belt - Sherdog.com"
2020-02-28 18:05,2020 NFL combine: Winners and losers from receiver and tight end drills; Denzel Mims and Chase Claypool shine - CBS Sports
2020-02-28 18:05,Trump Voters Big Mad at Garth Brooks Because They Can’t Tell NFL Great Barry Sanders and Bernie Sanders Apart - The Root
2020-02-28 18:05,Are pregnant women at risk for coronavirus? - Fox News
2020-02-28 18:05,Intense search underway in California for others exposed to coronavirus patient - Los Angeles Times
2020-02-28 18:05,WHO upgrades global risk of virus spread to ‘very high’ - South China Morning Post
2020-02-28 19:05,Appeals court blocks Trump administration from sending asylum seekers to Mexico to await hearings - CNN
2020-02-28 19:05,"Media's coronavirus stories trying to hurt Trump, Mick Mulvaney says as he urges public to turn off TV - CNBC"
2020-02-28 19:05,South Carolina Primary Voters Will Use Brand New Machines - NPR
2020-02-28 19:05,"US coronavirus staff were untrained and unprotected, says whistleblower - The Guardian"
2020-02-28 19:05,Broad anti-tobacco bill narrowly passes House - POLITICO
2020-02-28 19:05,Chinese Olympic swimmer Sun Yang handed 8-year ban in doping case - CBS News
2020-02-28 19:05,Growth of new coronavirus fuels questions over definition of pandemic - ABC News
2020-02-28 19:05,"Market corrections are scary but also, in some cases, necessary - msnNOW"
2020-02-28 19:05,"Verizon, AT&T, T-Mobile to be fined by FCC: Report - Fox Business"
2020-02-28 19:05,Samsung Galaxy S20 Ultra vs Galaxy Note 10+ (5G) - PhoneArena
2020-02-28 19:05,Fresh Gameplay Details For Animal Crossing: New Horizon Emerge From PAX East 2020 - Nintendo Life
2020-02-28 19:05,‘Wendy’ Review: Where Playtime Goes On … and On - The New York Times
2020-02-28 19:05,Deiveson Figueiredo misses weight; only Joseph Benavidez eligible for title at UFC on ESPN+ 27 - MMA Junkie
2020-02-28 19:05,"Live Science podcast ""Life's Little Mysteries"" special report: Coronavirus - Livescience.com"
2020-02-28 19:05,No country should make 'fatal' mistake of ignoring COVID-19: Tedros - UN News
2020-02-28 19:05,Northern California Woman With Coronavirus In Serious Condition - HuffPost
2020-02-28 20:05,Kudlow says Trump will get reelection boost from outbreak response: The latest on coronavirus - POLITICO
2020-02-28 20:05,House Democrats Inquire About Political Interference at the Justice Dept. - The New York Times
2020-02-28 20:05,"A dog in Hong Kong tests positive for the coronavirus, WHO officials confirm - CNBC"
2020-02-28 20:05,"Coronavirus live updates: Coronavirus risk upgraded to ""very high"" by World Health Organization as death toll mounts - CBS News"
2020-02-28 20:05,President Trump’s ‘Remain in Mexico’ policy blocked in federal court - The Washington Post
2020-02-28 20:05,Mick Mulvaney: Media is using coronavirus coverage to 'take down' Trump - New York Post
2020-02-28 20:05,House passes sweeping restrictions on flavored vaping and tobacco products - CNN
2020-02-28 20:05,Parscale: New states will 'come in play' for Trump over Democrats' health care policies | TheHill - The Hill
2020-02-28 20:05,"Erdogan, Putin discuss Syria as Turkey demands truce in Idlib - Al Jazeera English"
2020-02-28 20:05,"Dear CAS: With Flurry of Letters, Russia May Delay Olympic Ban - The New York Times"
2020-02-28 20:05,"Japan’s Abe faces mounting anger over school closures, lack of virus testing - The Washington Post"
2020-02-28 20:05,Paris Gare de Lyon: Fire at station amid Congo concert protest - BBC News
2020-02-28 20:05,"Fed's Powell says coronavirus poses 'evolving risks,' pledges to 'act as appropriate' for economy - CNBC"
2020-02-28 20:05,"Goldman Sachs predicts bigger COVID-19 hit on economy, Fed rate cuts - MarketWatch"
2020-02-28 20:05,The iPad Pro’s trackpad-wielding keyboard tells me Lenovo’s upcoming Chrome OS tablet is onto ... - Chrome Unboxed
2020-02-28 20:05,Amazon is the next to pull out of GDC over coronavirus fears - Engadget
2020-02-28 20:05,'Shark Tank' Star Barbara Corcoran Gets Her $388k Back from Scammers - TMZ
2020-02-28 20:05,Prince Harry and Jon Bon Jovi recreate 'Abbey Road' and more star snaps - Page Six
2020-02-28 20:05,"Patriots, Titans, Colts are potential landing spots for Tom Brady | Pro Football Talk | NBC Sports - NBC Sports"
2020-02-28 20:05,UFC 248 Free Fight: Israel Adesanya vs Robert Whittaker - UFC - Ultimate Fighting Championship
2020-02-28 20:05,James Harden escalates All-Star feud with Giannis Antetokounmpo - New York Post
2020-02-28 20:05,"Olympic Trials Marathon: ‘We Wanted to Give a Party, and Everybody Is Coming’ - The New York Times"
2020-02-28 20:05,"Freeman Dyson, Visionary Technologist, Is Dead at 96 - The New York Times"
2020-02-28 20:05,Melting ice in Antarctica reveals new uncharted island - Livescience.com
2020-02-28 20:05,Coronavirus outbreak: WHO official says virus not at stage to declare pandemic - Global News
2020-02-28 20:05,WHO raises global risk of coronavirus from 'high' to 'very high' - Reuters
2020-02-28 21:05,"Hospitals across the world are 'just not ready' for coronavirus, WHO official warns - CNBC"
