datetime,headline
2020-02-28 21:05,White House: 'Media stoking virus fears to take down Trump' - BBC News
2020-02-28 21:05,House Dems Say They're Looking Into Political Influence At Justice Department - NPR
2020-02-28 21:05,These are the democratic socialists backing Bernie Sanders - CNN
2020-02-28 21:05,"Driver crashes BMW through Pennsylvania day care, 5 children injured - NBC News"
2020-02-28 21:05,"As Iran's Leaders Contract Coronavirus, Doubts Emerge Over National Tally - Wall Street Journal"
2020-02-28 21:05,Chairman Jerome Powell says Fed ready to protect economy amid coronavirus fears - Washington Examiner
2020-02-28 21:05,Coronavirus fears send global markets into freefall | DW News - DW News
2020-02-28 21:05,"Wall Street's 'fear gauge' jumps to highest level in 2 years, on pace for biggest weekly gain in its history as stocks tumble - MarketWatch"
2020-02-28 21:05,"Coronavirus: From Facebook’s F8 to Mobile World Congress, here are all the major tech conferences canceled - Vox.com"
2020-02-28 21:05,Microsoft drops Cortana consumer skills in new Windows 10 update - The Verge
2020-02-28 21:05,‘Shark Tank’ star Barbara Corcoran gets back almost $400K after scam - Page Six
2020-02-28 21:05,Lady Gaga’s Message Remains Clear on ‘Stupid Love’: Just Dance - Vulture
2020-02-28 21:05,Harvey Weinstein Juror Speaks Out: #MeToo Movement Played No Role; Deliberations Not Divided On Gender Lines - Deadline
2020-02-28 21:05,What they're saying about Justin Herbert after the NFL Combine - 247Sports
2020-02-28 21:05,"Harden's right, Giannis doesn't have a lot of skill, talks Burrow & Tua draft — Gottlieb | THE HERD - The Herd with Colin Cowherd"
2020-02-28 21:05,Jim Walmsley is America’s best ultra runner. Why is he racing the U.S. Olympic Marathon Trials? - NBC Sports - Misc.
2020-02-28 21:05,Physicist And Iconoclastic Thinker Freeman Dyson Dies At 96 - NPR
2020-02-28 21:05,WHO declares rest of the world at 'very high' risk for coronavirus - MarketWatch
2020-02-28 21:05,The costs of secrecy - Science Magazine
2020-02-28 21:05,Watch live: World Health Organization holds press conference on the coronavirus outbreak - CNBC
2020-02-28 21:05,California monitoring 8400 people for coronavirus - CBS This Morning
2020-02-28 22:05,Federal appeals court rules against Trump in two major immigration cases - NBC News
2020-02-28 22:05,Mike Bloomberg says he's running for president until 'the bitter end' - New York Post
2020-02-28 22:05,House Votes to Ban Flavors in Cigarettes and E-Cigarettes - The New York Times
2020-02-28 22:05,"Bernie Sanders holds 2-1 lead in California primary, poll says - Los Angeles Times"
2020-02-28 22:05,Nato expresses 'full solidarity' with Turkey over Syria airstrikes - The Guardian
2020-02-28 22:05,Paris Gare de Lyon: Fire at station amid DR Congo concert protest - BBC News
2020-02-28 22:05,Stocks record worst week since financial crisis as coronavirus concerns heat up - MarketWatch
2020-02-28 22:05,Federal Reserve must quickly stop coronavirus stock market crash: trader - Yahoo Finance
2020-02-28 22:05,The S&P 500 is plunging at unprecedented speed - CNN
2020-02-28 22:05,Apple has blocked Clearview AI’s iPhone app for violating its rules - TechCrunch
2020-02-28 22:05,"The Games Of PAX East 2020 -- Animal Crossing, Doom Eternal, Streets Of Rage 4, Magic: Legends, And More - GameSpot"
2020-02-28 22:05,Disney’s massive media empire leads to Simpsons short with Pixar’s Onward - The Verge
2020-02-28 22:05,"Elisabeth Moss Said ""The Invisible Man"" Is A ""Pretty Gigantic, Obvious Analogy"" For Gaslighting - BuzzFeed News"
2020-02-28 22:05,Kaboom! Astronomers detect the universe's biggest explosion since the Big Bang - USA TODAY
2020-02-28 22:05,Up to a HUNDRED health workers were exposed to the undiagnosed coronavirus patient - Daily Mail
2020-02-28 22:05,The best prevention against the coronavirus is still washing your hands. Here's the proper way to do it - CNN
2020-02-28 23:05,Donald Trump Jr. Says Democrats Hope Coronavirus Will Kill Americans - Newsweek
2020-02-28 23:05,Trump wins appeal to block McGahn testimony - POLITICO
2020-02-28 23:05,CNN polls: Bernie Sanders holds big leads in California and Texas ahead of critical Super Tuesday vote - CNN
2020-02-28 23:05,"Mark Levin slams Schumer, Pelosi as 'the last people I want playing doctor with me or the American people' - Fox News"
2020-02-28 23:05,Appeals court halts Trump policy requiring asylum-seekers to wait in Mexico | TheHill - The Hill
2020-02-28 23:05,House approves bill to ban the sale of flavored e-cigarettes - Fox News
2020-02-28 23:05,Paris police evacuate Gare de Lyon train station after fire broke out - The Telegraph
2020-02-28 23:05,US stock markets continue to plunge over coronavirus uncertainty l ABC News Special Report - ABC News
2020-02-28 23:05,Stocks fall sharply on Wall Street; Dow Jones sinks 3.8% - KSL.com
2020-02-28 23:05,Trump says he hopes the Fed gets involved 'soon' to combat market sell-off from coronavirus - CNBC
2020-02-28 23:05,Samsung Galaxy Tab S6 Lite leak reveals an affordable Android tablet with an S Pen - Android Central
2020-02-28 23:05,Daily Crunch: Facebook cancels F8 over coronavirus concerns - TechCrunch
2020-02-28 23:05,Ranking All Mainline Final Fantasy Games From Worst To Best - GamingBolt
2020-02-28 23:05,Singer Normani rips Camila Cabello’s racist Tumblr posts - New York Daily News
2020-02-28 23:05,49ers meet with speedy Bama receiver Ruggs at combine - NBCSports.com
2020-02-28 23:05,"Katherine Johnson, pioneering Nasa mathematician, 1918-2020 - Financial Times"
2020-02-28 23:05,California woman with 'unknown origin' coronavirus case in serious condition - New York Post
2020-02-28 23:05,"After missteps, CDC says its coronavirus test kit is ready for primetime - NBCNews.com"
2020-02-29 00:06,Trump says he will nominate Rep. John Ratcliffe to be director of national intelligence - CNN
2020-02-29 00:06,"Congress Cannot Sue to Enforce Subpoenas Defied by Executive Branch, Appeals Court Rules - The New York Times"
2020-02-29 00:06,"Pence tells Rush Limbaugh, who said coronavirus has been overhyped: 'We're all in this together' - NBCNews.com"
2020-02-29 00:06,Republicans storm out of coronavirus briefing after Democrat rips Trump's response - POLITICO
2020-02-29 00:06,"NATO urges Russia, Turkey to halt Idlib attacks - Al Jazeera English"
2020-02-29 00:06,Coronavirus in Iran prompts US to extend olive branch amid claim country's death toll far higher than reported - Fox News
2020-02-29 00:06,Stock Market Plunge Delivers Worst Week For Wall Street Since 2008 - HuffPost
2020-02-29 00:06,Virus sell-off hands S&P 500 biggest drops at the opening bell - Financial Times
2020-02-29 00:06,Powell Opens Door to Fed Rate Cut on ‘Evolving’ Risks From Virus - Bloomberg
2020-02-29 00:06,Exclusive: Hands-on with Huawei’s unreleased P40 Series - Digital Trends
2020-02-29 00:06,"Roman Polanski Wins Best Director at France’s Cesar Awards, Prompting Walkouts - Variety"
2020-02-29 00:06,"Sad Harvey Weinstein confused by verdict, spending time reading Churchill - Page Six"
2020-02-29 00:06,Tennessee Titans have met with 4 2020 NFL Draft prospects at combine - Titans Wire
2020-02-29 00:06,James Harden vs. Giannis Antetokounmpo Is the NBA’s Latest Beef - The Ringer
2020-02-29 00:06,Tom Brady Drops Encouraging Comment On N’Keal Harry’s Latest Instagram - NESN
2020-02-29 00:06,"Henry Ruggs Separates Himself, Justin Herbert and Jalen Hurts Impress, More Combine Notes - Sports Illustrated"
2020-02-29 00:06,"Boeing's Starliner spacecraft is built to carry astronauts, but safety concerns loom - CNN"
2020-02-29 00:06,"After missteps, CDC says its coronavirus test kit is ready for primetime - NBC News"
2020-02-29 00:06,Santa Clara County Confirms New Case of Coronavirus - NBC Bay Area
2020-02-29 01:05,Appeals court says Don McGahn doesn't have to testify in major win for White House - CNN
2020-02-29 01:05,"Live updates: Second coronavirus case of unknown origin confirmed in California, indicating virus is spreading in the state - The Washington Post"
2020-02-29 01:05,Democratic Rivals Are Fighting Over Obama. He Has Some Opinions. - The New York Times
2020-02-29 01:05,CTA train shooting: Man shot by police at the Red Line’s Grand station - Chicago Sun-Times
2020-02-29 01:05,"Pence tells Limbaugh he believes Indiana work on HIV, MERS part of reason Trump tapped him on coronavirus | TheHill - The Hill"
2020-02-29 01:05,'Help me get it.' Pete Buttigieg's black surrogates face a skeptical audience for the candidate in South Carolina - USA TODAY
2020-02-29 01:05,"Ten pressing questions about coronavirus, answered by experts - The Boston Globe"
2020-02-29 01:05,Coronavirus: Risk of spread upgraded to highest level - BBC News
2020-02-29 01:05,Game Developers Conference canceled as tech conferences keep falling as fast as the stock market - MarketWatch
2020-02-29 01:05,Facebook’s 3D photos can now be made using single-camera phones - The Verge
2020-02-29 01:05,Normani 'hurt' by Camila Cabello's social media behavior - Los Angeles Times
2020-02-29 01:05,"Roman Polanski Wins Best Director at France’s Cesar Awards, ‘Les Miserables’ Wins Best Picture - Variety"
2020-02-29 01:05,"‘Hawaii Five-0’ To End After 10 Seasons On CBS, Sets Two-Hour Series Finale - New York Post"
2020-02-29 01:05,Ben Affleck 'had a breakdown' filming new movie when his character makes amends to wife: 'It was obviously real' - Yahoo Entertainment
2020-02-29 01:05,Offensive Linemen Run the 40-Yard Dash at the 2020 NFL Scouting Combine - NFL
2020-02-29 01:05,Wisconsin Badgers football: What Quintez Cephus’ mixed NFL Combine really means - Bucky's 5th Quarter
2020-02-29 01:05,"LA deputies shared graphic photos of Kobe Bryant crash scene, report says - The Guardian"
2020-02-29 01:05,Physicists model the supernovae that result from pulsating supergiants like Betelgeuse - Phys.org
2020-02-29 01:05,Boeing says thorough testing would have caught Starliner software problems - Spaceflight Now
2020-02-29 01:05,"Novel coronavirus outbreak: Additional COVID-19 cases confirmed in Solano and Santa Clara County, officials say - KGO-TV"
2020-02-29 01:05,CDC Defends Its Handling Of New Coronavirus Case In California - NPR
2020-02-29 01:05,The Coronavirus Stock Market Rollercoaster Isn't Stopping Anytime Soon - The Daily Beast
2020-02-29 02:06,Trump To Nominate Rep. John Ratcliffe To Top Intelligence Post - NPR
2020-02-29 02:06,"On Video, Chicago Police Shoot Man At Grand-State Red Line Station At Peak Of Rush Hour - CBS Chicago"
2020-02-29 02:06,"Court blocks Trump's ""Remain in Mexico"" policy - CBS News"
2020-02-29 02:06,"UC Davis student tested for coronavirus, 2 others isolated - Fox News"
2020-02-29 02:06,A pandemic expert questions speed of U.S. response to novel coronavirus - PBS NewsHour
2020-02-29 02:06,'Learn the hard way': Turkey warns Russia and Syria as US pledges 'full support' after soldiers killed - Washington Examiner
2020-02-29 02:06,Global stocks fall again on fear of virus impact on economy - The Associated Press
2020-02-29 02:06,2020 Game Developers Conference cancels due to coronavirus - Engadget
2020-02-29 02:06,"Amid Protests, Roman Polanski Wins Best Director at France’s Oscars - The New York Times"
2020-02-29 02:06,"Tyler Perry speaks out regarding death of his nephew, a Union Parish inmate - WBRZ"
2020-02-29 02:06,CBS Cancels 'Hawaii Five-0' and Fans React With Shock and Heartbreak - Showbiz Cheat Sheet
2020-02-29 02:06,"NFL evaluators weigh in on NFL combine performances from Jalen Hurts, Alabama wide receivers - AL.com"
2020-02-29 02:06,NFL analyst Tony Romo agrees to $17M per year to stay at CBS - New York Post
2020-02-29 02:06,What NFL Insider Thinks Would Signal Tom Brady Is Leaving Patriots In Free Agency - NESN
2020-02-29 02:06,"Freeman Dyson, famed physicist and creative force, dies at 96 - CNET"
2020-02-29 02:06,"Why Mars Needs Leap Days, Too - The New York Times"
2020-02-29 02:06,Second coronavirus case of 'unknown origin' confirmed in California: CDC - Fox News
2020-02-29 03:06,Mick Mulvaney says media covering coronavirus because they think it will 'bring down' Trump - USA TODAY
2020-02-29 03:06,DC Appeals Court Rules Don McGahn Can Defy A Subpoena From Congress - Slate
2020-02-29 03:06,"HHS secretary Azar defends White House coronavirus response: 'For the average American, nothing has changed' - Fox News"
2020-02-29 03:06,Coronavirus Update: Map Shows 60 U.S. Cases as Officials Prepare for the Virus to Spread - Newsweek
2020-02-29 03:06,Biden wins support of major Hollywood fundraiser - POLITICO
2020-02-29 03:06,Democrats Press for Data on Coronavirus Whistleblower Complaint - The Wall Street Journal
2020-02-29 03:06,"S&P falls for seventh day, suffers biggest weekly plunge since 2008 crisis - Reuters"
2020-02-29 03:06,Wall Street Closes Worst Week Since Financial Crisis Amid Coronavirus Fears | NBC Nightly News - NBC News
2020-02-29 03:06,‘Fortnite’ Deadpool Challenge: Where To Find The Milk Carton And Chimichangas At HQ - Forbes
2020-02-29 03:06,The Internet Archive’s VHS Vault will send you on a 90s nostalgia trip - The Verge
2020-02-29 03:06,First Call: Henry Ruggs III runs stunning 40-yard dash; Tom Brady's future; Penguins vs. struggling Ducks - TribLIVE
2020-02-29 03:06,Taylor leads all 2020 combine RBs with 4.39 40 - NFL.com
2020-02-29 03:06,Bernard Lagat reminded of Atlanta Games at U.S. Olympic Marathon Trials - OlympicTalk
2020-02-29 03:06,Olympic champion Sun Yang banned for 8 years in doping case - The Associated Press
2020-02-29 03:06,"Coronavirus: Symptoms, prevention, and how to prepare for a COVID-19 outbreak in the US - KABC-TV"
2020-02-29 03:06,"The situation in China is even worse than you think, says this analyst with a history of accurate calls - MarketWatch"
2020-02-29 04:05,Trump rallies his base to treat coronavirus as a ‘hoax’ - POLITICO
2020-02-29 04:05,Government Eyes War Powers to Speed Medical Manufacturing Ahead of Virus - The New York Times
2020-02-29 04:05,Live updates: Oregon coronavirus infection becomes third case of unknown origin in U.S. - The Washington Post
2020-02-29 04:05,Joe Biden baffles with promise to appoint 'first African-American woman' to Senate - Fox News
2020-02-29 04:05,Lawmakers react after coronavirus briefing: 'I do not think we're prepared' - CNN
2020-02-29 04:05,Buttigieg trudges toward low finish in South Carolina - POLITICO
2020-02-29 04:05,Marine general orders removal of Confederate items at bases - New York Post
2020-02-29 04:05,"Coronavirus outbreak: U.S. braces for rise in COVID-19 cases as WHO raises threat to ""highest level"" - Global News"
2020-02-29 04:05,Syria war: Refugees eye Europe as Turkey hits breaking point - BBC News
2020-02-29 04:05,"Dow Jones Plunges 800 Points, As Stock Market Correction Worsens; Nasdaq Hits Key Level - Investor's Business Daily"
2020-02-29 04:05,Final Fantasy XV and the joy of games that arrive unfinished - The A.V. Club
2020-02-29 04:05,Zombies icon Jason Blundell has left Treyarch ahead of CoD 2020 release - Dexerto
2020-02-29 04:05,Roman Polanski: Walkout as he wins best director at 'French Oscars' - BBC News
2020-02-29 04:05,CBS Suspends ‘The Amazing Race’ Production Over Coronavirus Fears (EXCLUSIVE) - Variety
2020-02-29 04:05,Hilary Duff asks Disney to move Lizzie McGuire reboot to Hulu instead of Disney+ - The Verge
2020-02-29 04:05,"2020 NFL combine results: Jonathan Taylor, Tristan Wirfs amaze as RBs and O-linemen run 40s, work out - CBSSports.com"
2020-02-29 04:05,Running Backs Run the 40-Yard Dash at the 2020 NFL Scouting Combine - NFL
2020-02-29 04:05,"California reports a second coronavirus case, likely from community spread - STAT"
2020-02-29 04:05,Coronavirus prevention: How to properly wash hands to stop the spread of germs - oregonlive.com
2020-02-29 04:05,Woman in Santa Clara County has coronavirus: What we know about the case - Los Angeles Times
2020-02-29 05:05,“Remain in Mexico”: 9th Circuit blocks Trump’s Migrant Protection Protocols - Vox.com
2020-02-29 05:05,Elizabeth Warren Has Won Black Activists. She’s Losing the Black Vote. - The New York Times
2020-02-29 05:05,"On Video, Chicago Police Shoot Man At Grand-State Red Line Station After He Was Moving Between Cars - CBS Chicago"
2020-02-29 05:05,Trump surveys South Carolina supporters on preferred Democratic opponent | TheHill - The Hill
2020-02-29 05:05,Trump urges South Carolina Republicans to vote for Bernie Sanders - New York Post
2020-02-29 05:05,Pete Buttigieg draws a crowd in South Carolina ahead of primary - CBS News
2020-02-29 05:05,Bloomberg tries to revise history on city term-limits fight - POLITICO
2020-02-29 05:05,"Confederate-related paraphernalia must be removed from all Marine installations, commandant orders - CNN"
2020-02-29 05:05,"As Fed Contemplates Coronavirus-Prompted Easing, Bitcoin Traders Bet on Halving - CoinDesk - Coindesk"
2020-02-29 05:05,CEOs Quitting in Record Numbers Could Signal Total Stock Market Collapse - CCN.com
2020-02-29 05:05,Ronan Farrow Lauds #MeToo After Verdict: 'There Are Harvey Weinsteins Everywhere' - NPR
2020-02-29 05:05,The one position that's never been more important is about to take center stage at the NFL combine - Yahoo Sports
2020-02-29 05:05,"Why Mars Needs a Leap Year, Too - The New York Times"
2020-02-29 05:05,"Remembering Space Pioneer Katherine Johnson on This Week @NASA – February 28, 2020 - NASA"
2020-02-29 05:05,Coronavirus is spreading through two more communities on the West Coast - The Washington Post
2020-02-29 05:05,How to prepare for coronavirus in the United States: 10 questions answered - WGHP FOX 8 Greensboro
2020-02-29 06:06,Trump says the coronavirus is the Democrats' 'new hoax' - CNBC
2020-02-29 06:06,Coronavirus mobile apps are surging in popularity in South Korea - CNN
2020-02-29 06:06,Virginia Gov. Ralph Northam vows to break deadlock on redistricting - The Washington Post
2020-02-29 06:06,Federal government says it won't put coronavirus patients in Costa Mesa - Los Angeles Times
2020-02-29 06:06,Reporting of coronavirus cases uneven as virus spreads globally - CBC News: The National
2020-02-29 06:06,Wall Street is telling clients the coronavirus meltdown could get worse - CBS News
2020-02-29 06:06,The coronavirus is making the weakest parts of the U.S. corporate debt boom wobble. Analysts say brace for things to get worse - MarketWatch
2020-02-29 06:06,China factory activity shrank at its fastest rate on record in February - CNBC
2020-02-29 06:06,Normani Responds to Camila Cabello’s Old Racist Posts: ‘It Was Devastating’ - Variety
2020-02-29 06:06,Tyler Perry orders second autopsy for nephew that died in Union Parish Detention Center - Knoe.com
2020-02-29 06:06,Best of Running Back Workouts at the 2020 NFL Scouting Combine - NFL
2020-02-29 06:06,Rutgers’ Home Court Is A House Of Horrors In A Conference Full Of Them - FiveThirtyEight
2020-02-29 06:06,Hoarding in the USA? Coronavirus sparks consumer concerns - Thomson Reuters Foundation
2020-02-29 06:06,Elementary School Employee Is Diagnosed With First Case Of Coronavirus In Oregon - HuffPost
2020-02-29 07:06,Federal Court Suspends Injunction On Trump's 'Remain In Mexico' Program - NPR
2020-02-29 07:06,Amy Klobuchar abandons South Carolina as she looks ahead to Super Tuesday - CNN
2020-02-29 07:06,"Tax cuts, tariff relief and travel restrictions: White House hunts for options to contain virus fallout - CNN"
2020-02-29 07:06,Father of boy whose body was found encased in concrete in Denver sentenced to 72 years - NBC News
2020-02-29 07:06,"The Trump-Bloomberg New York Story: Public Warmth, Private Disdain - The Wall Street Journal"
2020-02-29 07:06,"US to sign historic deal with Taliban, Trump announces, beginning end of US war in Afghanistan and withdrawal of American troops - ABC News"
2020-02-29 07:06,No-deal Brexit is back -- and it looks more likely than ever - CNN
2020-02-29 07:06,"Dow Drops 800 At Open, Extending Worst Week Since Financial Crisis | Velshi & Ruhle | MSNBC - MSNBC"
2020-02-29 07:06,China Manufacturing Plunges in February Amid Virus Controls - The New York Times
2020-02-29 07:06,"Coronavirus fears empty store shelves of toilet paper, bottled water, masks as shoppers stock up - USA TODAY"
2020-02-29 07:06,"Microsoft is killing off music, smart home, and third-party skills in Cortana - Neowin"
2020-02-29 07:06,"Tyler Perry Gets Nephew's 2nd Autopsy Results, Almost Certainly Suicide - TMZ"
2020-02-29 07:06,"©HICHARITO | Javier ""Chicharito"" Hernandez named 2020 LA Galaxy captain - LA Galaxy"
2020-02-29 07:06,'Black in Space' looks at final frontier of civil rights - NBCNews.com
2020-02-29 07:06,"Coronavirus Outbreak: Additional COVID-19 cases confirmed in Solano and Santa Clara counties, officials say - KGO-TV"
2020-02-29 07:06,It's likely there are more coronavirus cases in the United States than the numbers show - CNN
2020-02-29 08:06,Court reverses own decision on Trump's policy to require migrants to wait for asylum in Mexico - NBC News
2020-02-29 08:06,Coronavirus: Markets fall as Covid-19 spreads around the world - BBC News
2020-02-29 08:06,Geraldo Rivera: Biden will win South Carolina and carry momentum into Super Tuesday - Fox News
2020-02-29 08:06,US and Taliban poised to sign historic agreement - CNN
2020-02-29 08:06,"Tucker Carlson makes the case for 'stop and frisk', says NYPD found illegal guns 'by the thousands' - Fox News"
2020-02-29 08:06,There are fewer registered Republicans than independents for the first time ever | TheHill - The Hill
2020-02-29 08:06,Idlib: UN holds emergency session after Turkish troops killed - Al Jazeera English
2020-02-29 08:06,U.S. shuts border bridge to stop migrants rushing across from Mexico - Reuters
2020-02-29 08:06,Dow Jones Suffers Worst Week Since 2008 In Coronavirus Crash - Investor's Business Daily
2020-02-29 08:06,NFL Scouting Combine Notebook: AJ Dillon Storms Up the Draft Board - Bleacher Report
2020-02-29 08:06,"Houston Astros, caught cheating, are hit by errant pitches — coincidence? - NBC News"
2020-02-29 08:06,Coronavirus is spreading through three more communities on the West Coast - The Washington Post
2020-02-29 08:06,Elementary School Employee Diagnosed With First Coronavirus Case In Oregon - HuffPost
2020-02-29 08:06,Coronavirus: Infected Solano County patient wasn’t tested for 11 days - Vacaville Reporter
2020-02-29 09:05,Joe Biden fending off Bernie Sanders ahead of do-or-die South Carolina primary - New York Post
2020-02-29 09:05,"Mike Bloomberg in 2017: ""People know where I stand"" - 60 Minutes"
2020-02-29 09:05,"'Medicare for All' group's campaign could benefit Sanders, Warren in S.C. - POLITICO"
2020-02-29 09:05,CDC Defends Its Handling Of Coronavirus Case In California - NPR
2020-02-29 09:05,'Political interference': Jerry Nadler seeks testimony from John Durham about Russia inquiry review - Washington Examiner
2020-02-29 09:05,Survey: 38% of Americans won’t buy Corona beer ‘under any circumstances’ because of coronavirus outbreak - KTLA
2020-02-29 09:05,Call of Duty Zombies Director Jason Blundell Leaves Treyarch - Comicbook.com
2020-02-29 09:05,Facebook's F8 cancellation puts spotlight on other big tech events - CNET
2020-02-29 09:05,New Windows 10 update: Microsoft tries again to fix Search bugs - ZDNet
2020-02-29 09:05,"Deputies were ordered to delete Kobe Bryant crash photos to avoid discipline, sources say - Los Angeles Times"
2020-02-29 09:05,Browns Mailbag: What would it take for the Browns not to use their 1st-round pick on an offensive tackle? - clevelandbrowns.com
2020-02-29 09:05,Hoarders: Americans stock-up on supplies as virus fear spreads - Al Jazeera America
2020-02-29 09:05,Message to Campus Community on COVID-19 - UC Davis
2020-02-29 09:05,Why U.S. Markets Could Recover Quickly From Coronavirus Hit - Barron's
2020-02-29 10:06,Coronavirus Live Updates: South Korea Reports 800 New Cases - The New York Times
2020-02-29 10:06,"Trump goes full racist, of course, to cover up coronavirus lies and incompetence - Salon"
2020-02-29 10:06,"Pentagon, State Department envoy clash over sending Patriot missiles to Turkey - POLITICO"
2020-02-29 10:06,"Schiff says Trump's coronavirus response doesn’t ‘inspire confidence,’ ramping up political fight - Fox News"
2020-02-29 10:06,This arrest shows you what virus China's rulers truly fear - New York Post
2020-02-29 10:06,"Joe Coulombe, founder of popular Trader Joe's markets, dies - The Associated Press"
2020-02-29 10:06,Deadpool Challenge Week two | FORTNITE SEASON 2 - GamesRadar
2020-02-29 10:06,Hilary Duff asks Disney to move 'Lizzie McGuire' revival to Hulu: 'It would be a dream' - USA TODAY
2020-02-29 10:06,CBS Suspends ‘The Amazing Race’ Production Over Coronavirus Fears (EXCLUSIVE) - Yahoo Celebrity
2020-02-29 10:06,Baseball's Fight to Reclaim Its Soul - Sports Illustrated
2020-02-29 10:06,State officials announce first presumptive case of coronavirus in Oregon - KPTV.com
2020-02-29 10:06,2 new coronavirus cases in Washington: Snohomish Co. high school student and King Co. woman - Q13 News Seattle
2020-02-29 11:05,"Coronavirus live updates: Trump calls outbreak a 'hoax,' South Korea has record jump in cases - CNBC"
2020-02-29 11:05,U.S. Expected to Sign Deal With Taliban to Withdraw Troops From Afghanistan - The New York Times
2020-02-29 11:05,Coronavirus patient's dog tests positive for COVID-19 but still unclear if it's infected - USA TODAY
2020-02-29 11:05,‘Significant questions’ after video shows Chicago police officer shoot man in Red Line station - Chicago Sun-Times
2020-02-29 11:05,Ingraham: Biden bets it all on South Carolina - Fox News
2020-02-29 11:05,"Mike Bloomberg deploys his billions to make a point, from a $1 million couch to a presidential campaign - The Washington Post"
