datetime,headline
2020-02-29 11:30,Corte Suprema de Justicia eligió nuevos magistrados y llenó seis de las ocho vacantes - El País – Cali
2020-02-29 11:30,Автобус с детской футбольной командой опрокинулся в российском регионе - Lenta
2020-02-29 11:30,Герасимов и Милли обсудили Сирию. Помпео пожаловался на Дамаск и Тегеран - Вести.Ru
2020-02-29 11:30,За нарушения на голосовании по Конституции предусмотрят до четырех лет колонии - Интерфакс
2020-02-29 11:30,Son dakika! NATO İdlib'deki saldırının ardından olağanüstü toplandı! - Haberler - Habertürk
2020-02-29 11:30,"Helen Mirren ‘applauds’ Prince Harry, Meghan Markle’s decision to step back from royal duties - Fox News"
2020-02-29 11:30,Echevarría se impone en mitin atlético bajo techo de Noruega con marca de 8.08 metros - CubaDebate
2020-02-29 11:30,【武漢肺炎】中國明抄日本！ 贈韓2.5萬口罩紙箱寫「道不遠人、人無異國」 - 香港蘋果日報 - 即時新聞
2020-02-29 11:30,Cobre y zinc caen a mínimos de casi tres años por temor a coronavirus - Diario Gestión
2020-02-29 11:30,"Rupiah Babak Belur, Dolar AS Melesat ke Rp 14.500 - detikFinance"
2020-02-29 11:30,Κορονοϊός: Ήπια συμπτώματα ίωσης παρουσιάζουν 5 από τους μαθητές του Κολλεγίου Αθηνών - Κοινωνία | News 24/7 - NEWS 24/7
2020-02-29 11:30,Buddy Franklin shares first photo of newborn daughter Tallulah as wife Jesinta calls her their 'forever angel' - 9Honey
2020-02-29 11:30,Shikwambi cautions motorists to be extra cautious during the rainy season - nbc.na
2020-02-29 11:30,دراسة مثيرة للجدل حول قدرة المضادات الحيوية الحالية على معالجة فيروس كورونا - روسيا اليوم
2020-02-29 11:30,Internet access hangs by a thread for hundreds of millions - TechRadar
2020-02-29 11:30,"Лыжные гонки. Лыжные гонки, Кубок мира, Лахти, индивидуальная гонка, мужчины прямая текстовая онлайн трансляция - SPORT.RU"
2020-02-29 11:30,Oregon coronavirus infection becomes third case of unknown origin in U.S. - The Washington Post
2020-02-29 11:30,Mau Tahu..? Ini Alasan di Balik Terciptanya Kondom Aneka Rasa - Harianhaluan.com
2020-02-29 11:30,كم خسر أثرياء العالم بأسبوع جراء كورونا؟ - العربية
2020-02-29 11:30,السودان يعلن ملاحظاته بشأن الاتفاقية الشاملة لـ سد النهضة - Sada El-Bald صدى البلد
2020-02-29 11:30,Leonardo DiCaprio fue captado ayudando a un turista perdido en Nueva York y las imágenes se hicieron virales - Canal Net Tv
2020-02-29 11:30,The nearly 360-degree display of the Xiaomi Mi Mix Alpha shown in hands-on video - Android Authority
2020-02-29 11:30,EXPLAINER-How long can coronavirus survive on surfaces? - Thomson Reuters Foundation
2020-02-29 11:30,Parliament sitting on March 9 is the next battleground - Malaysiakini
2020-02-29 11:30,Rusya: Türkiye ile tansiyonu düşürmek için anlaştık - Cumhuriyet
2020-02-29 11:30,Proponen usar orina de astronautas para crear bases en la Luna - El Nuevo Dia.com
2020-02-29 11:30,"Αγορές: Χωρίς τέλος η βουτιά σε Ευρώπη, Wall Street | naftemporiki.gr - naftemporiki.gr"
2020-02-29 11:30,Keetmans held PPD meeting - Namibian
2020-02-29 11:30,Συμφωνία για «αποκλιμάκωση της έντασης» μεταξύ Τουρκίας-Ρωσίας για το Συριακό - CNN Greece
2020-02-29 11:30,Reportan segundo caso de coronavirus en California | El Universal - El Universal
2020-02-29 11:30,GDC 2020 has been canceled - TechCrunch
2020-02-29 11:30,Chinese Rover Discovers It's Sitting on 39 Feet of Moon Dust - Futurism
2020-02-29 11:30,致敬志愿者，战“疫”中一束温暖的光--社会 - 人民网
2020-02-29 11:30,"ব্যাগে ছিনতাইকারী টান, ছিটকে পড়ে নারীর মৃত্যু - bdnews24.com"
2020-02-29 11:30,"TVP pokazała film Ranczo Wilkowyje i pożegnała Pawła Królikowskiego. Kondolencje, nekrolog - Plejada.pl"
2020-02-29 11:30,النفط يتكبد أكبر خسارة أسبوعية منذ 2016 - البيان
2020-02-29 11:30,Coronavirus: Sinohydro projects to delay – Roads Minister hints - GhanaWeb
2020-02-29 11:30,Kotoko eager to bounce back against Bechem Utd - GhanaWeb
2020-02-29 11:30,МЧС подтвердило гибель пилота при крушении вертолета под Астраханью - РИА Новости
2020-02-29 11:30,علماء صينيون يحققون اكتشافا مثيرا للجدل حول كورونا الفتاك! - روسيا اليوم
2020-02-29 11:30,日本政府鼓励企业推行员工在家办公制度 风险管控不容忽视--日本频道--人民网 - 人民网
2020-02-29 11:30,Mogo Wildlife Park reopens to public after bushfires - NEWS.com.au
2020-02-29 11:30,Ліга Європи. Шахтар за сумою двох матчів проходить Бенфіку - Українська правда
2020-02-29 11:30,Ganggang Hijau Berusia Miliaran Tahun Diduga Nenek Moyang dari Semua Tanaman di Bumi - Trubus.id
2020-02-29 11:30,陳維齡經常被小咖藝人放鳥 宋逸民點名「越大咖越謙卑」 - Yahoo奇摩新聞
2020-02-29 11:30,¿Son los estrógenos la razón por la que el coronavirus afecta a más hombres que mujeres en China? - Yahoo Noticias
2020-02-29 11:30,Científicos descubren el primer animal que puede sobrevivir sin respirar - Panorama.com.ve
2020-02-29 11:30,Ανακαλύφθηκε η μεγαλύτερη έκρηξη στο σύμπαν | Επιστήμη | Η ΚΑΘΗΜΕΡΙΝΗ - Η Καθημερινή
2020-02-29 11:30,Ezema fears nationwide crisis' effect on election - The Reporter Ethiopia
2020-02-29 11:30,السعودية.. أمير الشرقية يوجه بدراسة طلب والد أحد المخطوفين - العربية
2020-02-29 11:30,Coronavirus kills 210 persons in Iran - The Punch
2020-02-29 11:30,Yarışı kazanan Toprak Razgatlıoğlu İdlib şehitlerini unutmadı - YeniÇağ
2020-02-29 11:30,Las teorías que han circulado sobre el coronavirus - ElEspectador.com
2020-02-29 11:30,PKR says Serian MP has defected to its side - Malaysiakini
2020-02-29 11:30,History shows market shocks can roil gold price action - both higher and lower - Kitco NEWS
2020-02-29 11:30,Up to 40 people possibly exposed to coronavirus at Gold Coast salon - SBS News
2020-02-29 11:30,بطولات يكشف تجميد كهربا في الأهلي.. اتفاق بين الخطيب وعبد الحفيظ وعقوبة مالية - بطولات
2020-02-29 11:30,‘Human Computer’ for NASA Space Flights Dies at 101 - VOA Learning English
2020-02-29 11:30,La autopsia a un fallecido por el coronavirus revela los daños que genera esa enfermedad - RT en Español
2020-02-29 11:30,陳蕊蕊富貴有20盒口罩 - 雅虎香港新聞
2020-02-29 11:30,Texas: El rompimiento de una tubería desata el caos en Houston - Mundo Hispánico
2020-02-29 11:30,"Samsung Produksi Masal RAM 16GB Smartphone, Lebih Cepat nan Hemat Daya! | merdeka.com - merdeka.com"
2020-02-29 11:30,¿Peligra el clásico vallecaucano? Esto dijeron las autoridades de Cali - Canal RCN
2020-02-29 11:30,武漢肺炎》中日韓、伊朗、美國為何都招架不住？新冠病毒顯露各國統治階層的哪些失敗？ - 風傳媒
2020-02-29 11:30,Порошенко побував на допиті в ДБР - 24 Канал
2020-02-29 11:30,Huawei Mate XS: el nuevo plegable de Huawei. - TecnolikePlus
2020-02-29 11:30,"Guillermo Coppola le apuntó a Juan Román Riquelme: ""En su partido despedida se puso tu camiseta, hay que te... - TNT Sports"
2020-02-29 11:30,"US, Taliban gear up for Afghanistan deal - NEWS.com.au"
2020-02-29 11:30,Fake news για πλοίο που θα παραλάβει πρόσφυγες από τη Λέσβο - Η Εφημερίδα των Συντακτών
2020-02-29 11:30,"أردوغان ""يبتز"" ألمانيا.. ويؤكد عبور 18 ألف مهاجر إلى أوروبا - سكاي نيوز عربية"
2020-02-29 11:30,Cae acosador del Metro denunciado en redes sociales - Excélsior
2020-02-29 11:30,Kenya: Mother of One Wants Olympics Chance - AllAfrica.com
2020-02-29 11:30,Concluye juicio a disidente cubano foco de tensión con EEUU - El Nuevo Herald
2020-02-29 11:30,Bon Jovi trabaja en nuevo sencillo junto al príncipe Harry - Tónica
2020-02-29 11:30,SuperSport | Super Rugby | Reds v Sharks | Interview with Liam Wright - SuperSport
2020-02-29 11:30,সাতক্ষীরায় ক্লিনিকের অভ্যর্থনাকারীকে ধর্ষণের অভিযোগ - প্রথম আলো
2020-02-29 11:30,China's Rover Finds Layer of Dust Almost 12 Metres Deep on The Far Side of The Moon - ScienceAlert
2020-02-29 11:30,Елисеев одержал победу в спринте на чемпионате Европы по биатлону - Чемпионат.com
2020-02-29 11:30,Матч «Ювентус» – «Интер» перенесен из-за коронавируса - Sports.ru
2020-02-29 11:30,《邊緣禁地3》Epic獨佔約滿 3月確定登上Steam - udn 遊戲角落
2020-02-29 11:30,Danza Contemporánea de Cuba abre temporada por sus 60 años - Prensa Latina
2020-02-29 11:30,Israeli researchers announce breakthrough on coronavirus vaccine - TheCable
2020-02-29 11:30,¿Rodrigo González tendrá programa en las mañana para competir contra “Mujeres al mando”? - exitosanoticias
2020-02-29 11:30,微軟新Android 手機傳提早開賣！但規格或許會有點「小失望」 - 自由時報電子報
2020-02-29 11:30,World prepares for coronavirus pandemic; global recession forecast - TODAYonline
2020-02-29 11:30,"Após maratona de decisões, Flamengo encara a Cabofriense na estreia da Taça Rio - Coluna do Fla"
2020-02-29 11:30,Vera Cruz é considerada infestada pelo mosquito Aedes aegypti - GAZ
2020-02-29 11:30,Hoarding in the USA? Coronavirus sparks consumer concerns - The Straits Times
2020-02-29 11:30,Scientists measured a property of the neutron more precisely than ever before - Tech Explorist
2020-02-29 11:30,Inflation could hit 3.2% in February – BSP - Manila Bulletin
2020-02-29 11:30,Santos define 30 inscritos na Libertadores: veja nova numeração - Gazeta Esportiva
2020-02-29 11:30,關於《愛的迫降》玄彬「脫北」的故事，有多少是真的？12本書重新認識「利正赫」！ - ELLE 台灣
2020-02-29 11:30,FIR registered against students for Punjab University clashes - The News International
2020-02-29 11:30,"Muhyiddin picked as Malaysia's 8th PM, to be sworn in on Sunday - TODAYonline"
2020-02-29 11:30,El LG V60 y el Sony Xperia 1 II superan a los Galaxy S20 en algunos aspectos - CNET en Español
2020-02-29 11:30,Χαμός για τη ρύθμιση των 24 και 48 δόσεων παρά το… επιτόκιο ? ... - Newsit
2020-02-29 11:30,بعد نفاده مرتين.. إقبال خرافي على هذا الهاتف في الإمارات - Sada El-Bald صدى البلد
2020-02-29 11:30,"Nagita Slavina Keguguran, Raffi Ahmad Ternyata Sempat Menunda Rencana Punya Anak - Grid.ID"
2020-02-29 11:30,Google Earth Now Available for Browsers Other Than Chrome - Somag News
2020-02-29 11:30,"Szymon Hołownia zmienia zdanie ws. pigułki ""dzień po"". Zalały go wiadomości od oburzonych kobiet - Wiadomosci Gazeta.pl"
2020-02-29 11:30,Exoplaneta bem maior que a Terra é candidato sério a abrigar vida - Revista Planeta
2020-02-29 11:30,Family of Molson Coors shooting suspect expresses 'sadness and heartache' - CNN
2020-02-29 11:30,"Ingram, Zion lead Pelicans past Cavaliers - INQUIRER.net"
2020-02-29 11:30,"Cloroquina: conoce el medicamento que podría curar el coronavirus, según estudio - LaRepública.pe"
2020-02-29 11:30,تركيا تواصل لليوم الثاني فتح حدودها لتدفق اللاجئين إلى أوروبا - العربية
2020-02-29 11:30,"Я вчусь дарувати людям любов, – Jerry Heil зі сльозами розповіла про стосунки та особисте життя - 24 Канал"
2020-02-29 11:30,Samsung Galaxy A11 appears in a render with punch hole display and triple rear cameras - GSMArena.com news - GSMArena.com
2020-02-29 11:30,【政圈風聲】派錢成陳茂波的天降「橫財」 惟預算案藏小炸彈？ - 香港01
2020-02-29 11:30,"Suriah Panas! Putin Kirim Kapal Perang, Erdogan Telepon Trump - CNBC Indonesia"
2020-02-29 11:30,Uganda plays Tanzania in FIFA U-17 WC qualifier - NTVUganda
2020-02-29 11:30,Former Majority Leader cautions against coronavirus - GhanaWeb
2020-02-29 11:30,"Hollywood star, Jamie Foxx, plans to travel to Ghana - Myjoyonline.com"
2020-02-29 11:30,Dron revela imágenes de los letales ataques turcos al Gobierno sirio - Uno TV Noticias
2020-02-29 11:30,EMGS receives LOI for multi-client pre-funding in Namibia - WorldOil
2020-02-29 11:30,Пристайко розповів про відмінність у підходах до зовнішньої політики з Єрмаком - УНІАН
2020-02-29 11:30,Discovering what makes durian fruit stink: First evidence of rare amino acid in plants - Science Daily
2020-02-29 11:30,Virus Corona Bisa Bikin Liverpool Gagal Juara Liga Inggris - CNN Indonesia
2020-02-29 11:30,ماذا أظهرت نتائج تشريح 11 جثة مصابة بفيروس كورونا؟ - البيان
2020-02-29 11:30,Servidor público pode financiar casa própria com taxa de juros menor - Edital Concursos Brasil
2020-02-29 11:30,¿Llegará a la Argentina? Citroën presenta un auto que se podrá conducir sin licencia (en Europa) - MDZ Online
2020-02-29 11:30,土耳其驻扎在叙利亚不是为了领土或石油 - TRT 中文网站
2020-02-29 11:30,"Google Earth: Διαθέσιμη η υπηρεσία και σε Firefox, Opera, Edge - Τεχνολογία | News 24/7 - NEWS 24/7"
2020-02-29 11:30,['Love is Blind' finale: Now we see] - Mash Viral
2020-02-29 11:30,Banned Melbourne financial adviser jailed for swindling millions from clients - 9News
2020-02-29 11:30,Sun Yang: I will appeal against CAS decision - The Star Online
2020-02-29 11:30,"4 دقائق مدة الرصد بين مخالفات ""الحزام"" و""الجوال"" بنفس اليوم - سبق"
2020-02-29 11:30,İdlib saldırısının ardından ABD’den flaş açıklama - Amkspor
2020-02-29 11:30,加利利傳來的福音？以色列科技部長：武漢肺炎病毒疫苗數周內就緒 - HiNet 新聞社群
2020-02-29 11:30,Coronavirus news: South Korea reports 'critical moment' after 813 new cases – live updates - The Guardian
2020-02-29 11:44,"Ασφαλιστικό : Οι 15 αλλαγές σε συντάξεις, εισφορές και μπλοκάκια - News.in.gr"
2020-02-29 11:44,وفاة الدكتور محمد عمارة عضو هيئة كبار العلماء بعد صراع مع المرض - مصراوي
2020-02-29 11:44,محيط مستشفى بيروت: الخوف خرج من غرف الحجر! - mtv.com.lb
2020-02-29 11:44,How extended can coronavirus endure on surfaces? - gotech daily
2020-02-29 11:44,World Health Organization raises coronavirus risk to 'very high' as South Korea cases surge - SBS News
2020-02-29 11:44,River recibirá a Defensa y Justicia con la misión de quedar a un paso del título - La Página Millonaria
2020-02-29 11:44,Η ευκαιρία καριέρας του Μπα και το δίδυμο με τον Σισέ - gazzetta.gr
2020-02-29 11:44,Sheriff's department investigating whether deputies shared Kobe Bryant crash scene photos - CNN Philippines
2020-02-29 11:44,Le rompieron el invicto al equipo de Ramón - Goal.com
2020-02-29 11:44,"Giannis Antetokoumnpo Pours In 32 PTS, 13 REB, 6 AST In 3 Qtrs. Over Thunder - Bleacher Report"
2020-02-29 11:44,"Дорофєєва задерла спідницю і показала, що під нею (фото) - УНІАН"
2020-02-29 11:44,"Νούνο Εσπίριτο Σάντο: Άνθισε στο Τριφύλλι, δαγκώνει με τους Λύκους - Newsbeast.gr"
2020-02-29 11:44,Глава Генштаба ВС России обсудил с американским генералом ситуацию в Сирии - Аргументы и факты
2020-02-29 11:44,Смартфон Samsung Galaxy A41 с тройной камерой позирует на рендерах - 3DNews
2020-02-29 11:44,مهاتير محمد يعلن اعتزامه الترشح لمنصب رئيس وزراء ماليزيا - المصري اليوم
2020-02-29 11:44,Why Gold Is Suddenly Crashing Along With Stocks - CCN.com
2020-02-29 11:44,Меган Маркл и принц Гарри обошли по популярности Кейт Миддлтон и принца Уильяма в инстаграме: самые популярные фото пары - Сплетник
2020-02-29 11:44,Indústria da China registra tombo maior do que em 2008 - O Antagonista
2020-02-29 11:44,إشبيلية-روما الأبرز في ثمن نهائي الـ”يوروبا ليغ” - قناة المنار
2020-02-29 11:44,"Thêm 427 người nhiễm virus corona tại Trung Quốc, tổng cộng 79.251 ca - Zing.vn"
2020-02-29 11:44,One in five of UK's top FTSE 350 firms warned over gender diversity - BBC News
2020-02-29 11:44,الفرق ساعة.. شاهد بكاء مجدي عبد الغني في عزاء مبارك وضحكه في فرح ابنة مدحت شلبي - Sada El-Bald صدى البلد
2020-02-29 11:44,São João Batista tem um caso suspeito de coronavírus - O Município Blumenau
2020-02-29 11:44,Κυβέρνηση: «Οργανωμένη απόπειρα» παραβίασης των ελληνικών συνόρων στον Έβρο - HuffPost Greece
2020-02-29 11:44,Почему американских фермеров накрыла волна самоубийств - Взгляд
2020-02-29 11:44,A reação de Zezé ao ver melhora do pai é de cortar o coração - 1News Brasil
2020-02-29 11:44,Τα δεδομένα για Βιεϊρίνια στον ΠΑΟΚ - Sportdog.gr
2020-02-29 11:44,"Google Maps: creyó ver a dos mujeres en pleno ‘acto íntimo’, hace zoom y descubre la verdad [FOTOS] - LaRepública.pe"
2020-02-29 11:44,Βίντεο-ντοκουμέντο από την επίθεση μεταναστών στους συνοριοφύλακες στον Εβρο - Η Καθημερινή
2020-02-29 11:44,Crisis hits Cross River PDP as Ayade men threaten to recall NASS members - Vanguard
2020-02-29 11:44,How long can coronavirus survive on surfaces? - The Jakarta Post - Jakarta Post
2020-02-29 11:44,Coronavirus Vaccine Could Be Available in 90 Days - Israeli Scientists - Sputnik International
2020-02-29 11:44,Pre-Watford stats: Salah and Mane chasing 20-goal treble for LFC - Liverpool FC
2020-02-29 11:44,Bolsonaro se desmarca de las protestas contra el Congreso y el Tribunal Supremo - Diario LAs Americas
2020-02-29 11:44,赞韩国“不封城”，黑中国“不民主”？美媒要在自嗨中自欺多久？ - 京报网
2020-02-29 11:44,গুগল ডুডলে শোভা পাচ্ছে লিপ ইয়ার - বাংলানিউজটোয়েন্টিফোর.কম
2020-02-29 11:44,People return to Shanghai as China slowly eases coronavirus-induced restrictions - UNTV News - UNTV News
2020-02-29 11:44,"‘Hawaii Five-0’ To End After 10 Seasons On CBS, Sets Two-Hour Series Finale - New York Post "
2020-02-29 11:44,Пентагон підписав угоду з виробництва комплексів Javelin для України - espreso.tv
2020-02-29 11:44,The $60 Raspberry Pi Desktop Computer Now Comes With Twice As Much RAM - Gizmodo Australia
2020-02-29 11:44,Λέσβος: Δραματική διάσωση μεταναστών - Συγκλονιστικές εικόνες - Κοινωνία | News 24/7 - NEWS 24/7
2020-02-29 11:44,"Coronavirus: Death toll in China jumps to 2,788 - ARY NEWS"
2020-02-29 11:44,战“疫”在前使命在肩 - 东方财富网
2020-02-29 11:44,Πυροβολισμός έξω από σπίτι πρώην υπουργού με εμπλοκή αστυνομικού - Documento
2020-02-29 11:44,"Οχι, οι κατινιές δεν είναι... αλατοπίπερο | Τηλεόραση | Η ΚΑΘΗΜΕΡΙΝΗ - Η Καθημερινή"
2020-02-29 11:44,习近平：全面提高依法防控依法治理能力健全国家公共卫生应急管理体系-新华网 - 新华网
2020-02-29 11:44,Coronavirus: Australia announces Iran travel ban as death figures soar - NEWS.com.au
2020-02-29 11:44,ثلاثية بنيديتو تعزز موقع مرسيليا في المركز الثاني - رويترز العربية
2020-02-29 11:44,"Piotr Wadecki, dyrektor CCC Team, o koronawirusie w Abu Dhabi - UAE Tour 2020 | Eurosport w TVN24 - Sport TVN24"
2020-02-29 11:44,Desempleo creció en enero y llegó al 13 % - El Colombiano
2020-02-29 11:44,全球疫情延燒！為何還有人「堅持出國玩」 眾秒揭關鍵 - Yahoo奇摩
2020-02-29 11:44,في بيروت... توقيف فتيات يمارسن الدعارة بالجرم المشهود - Al Jadeed Official Website
2020-02-29 11:44,School districts preparing for coronavirus - ABC 10 News
2020-02-29 11:44,First case of coronavirus in Wales as two more in England confirmed - Chelmsford Weekly News
2020-02-29 11:44,遭水槍噴射鋪蓋 武漢街頭滯留人員被當局驅逐 - 大紀元
2020-02-29 11:44,В ДТП с автобусом в Ульяновской области пострадали девять детей - РБК Недвижимость
2020-02-29 11:44,Ουγγαρία: Λαμβάνει μέτρα στα σύνορα λόγω των μεταναστευτικών ροών από την Τουρκία - Zougla
2020-02-29 11:44,An Israeli Political Aide Confided to His Rabbi. He Was Being Recorded. - The New York Times
2020-02-29 11:44,The big question facing Democrats (and independents): Who to vote for - CNN
2020-02-29 11:44,"Enfileirando títulos, Flamengo é visto como favorito no jogo contra a Cabofriense - Coluna do Fla"
2020-02-29 11:44,Las tensiones que se acentúan con el informe de la ONU - ElEspectador.com
2020-02-29 11:44,شعبة المعلومات تكشف ملابسات جريمة قتل حصلت في سن الفيل - mtv.com.lb
2020-02-29 11:44,"Зеленський і медіагрупи домовилися про запуск незакодованих версій українських телеканалів, - ОПУ - espreso.tv"
2020-02-29 11:44,"Chia tay Trấn Thành lấy chồng Việt kiều kém tuổi, cuộc sống Mai Hồ giờ ra sao? - Vietnamnet.vn"
2020-02-29 11:44,"John Cena's homecoming spoiled by “The Fiend” Bray Wyatt: SmackDown, Feb. 28, 2020 - WWE"
2020-02-29 11:44,"Ερντογάν: Ανοίξαμε τα σύνορα, 18.000 μετανάστες πέρασαν στην Ευρώπη -Σήμερα θα φτάσουν τους 30.000 - iefimerida"
2020-02-29 11:44,"‘Afghan peace deal a victory for the Taliban’, says Mullah Abdul Salam Zaeef ahead of Qatar ceremony - Business Recorder"
2020-02-29 11:44,Эпидемия становится пандемией - Meduza
2020-02-29 11:44,El coronavirus sacude Wall Street y siembra el pánico en EEUU - Sputnik Mundo
2020-02-29 11:44,Watch: President Trump Hosts Campaign Rally In South Carolina - RealClearPolitics
2020-02-29 11:44,Massachusetts state health lab given approval to test for coronavirus - WCVB Boston
2020-02-29 11:44,Εργαστήρια σε Πάτρα και Κρήτη ρίχνονται στη «μάχη» του κορονοϊού - Η Εφημερίδα των Συντακτών
2020-02-29 11:44,دوري أبطال أفريقيا: الزمالك يواصل انتصاراته والرجاء يضرب مازيمبي بهدفين - BBC Arabic
2020-02-29 11:44,Warren asks administration for assurances that sanctions aren't hindering coronavirus containment in Iran | TheHill - The Hill
2020-02-29 11:44,"Atlético-MG quer treinador de ""primeira linha"", descarta aposta e volta a conversar com Sampaoli - globoesporte.com"
2020-02-29 11:44,"ইরানে করোনাভাইরাসে ২১০ মৃত্যু, দাবি হাসপাতাল সূত্রের - bdnews24.com"
2020-02-29 11:44,Jubir Wapres soal Hoax Jemaah RI Ditolak Saudi karena Corona: Ini Berbahaya - detikNews
2020-02-29 11:44,Nuevos argumentos esclarecen ausencia de fraude a favor de Evo en Bolivia - Radio Cadena Agramonte
2020-02-29 11:44,Why Buhari made a U-turn on legislators’ jumbo pay – Presidency - The Punch
2020-02-29 11:44,"Coronavirus: Crash Landing On You's Son Ye-jin, BTS' Suga donate to native Daegu - The Straits Times"
2020-02-29 11:44,Wybory prezydenckie 2020. Prezydent Andrzej Duda krytykuje protestujących sędziów - Wirtualna Polska
2020-02-29 11:44,Những tín đồ không sợ nCoV - VnExpress
2020-02-29 11:44,"Coronavirus detected in sub-Saharan Africa, global stocks tank - DAWN.com"
2020-02-29 11:44,"430.000 Tiket Pesawat Diskon 50% Diobral Besok, Serbu! - CNBC Indonesia"
2020-02-29 11:44,Coronavirus: 2d US 'community spread' case in Santa Clara County - Business Insider - Business Insider
2020-02-29 11:44,Xiaomi needs a better way to unbrick its devices instead of Authorized Mi Accounts - XDA Developers
2020-02-29 11:44,Southeast Asian supply chains feel the squeeze from Covid-19 - South China Morning Post
